"Kiehl's Midnight Recovery Concentrate","By Kiehl's","4.6 (1112 reviews)","4 varieties from $46.00",2018/03/07
"OLEHENRIKSEN Truth Serum(R) 3.4 oz/ 100 mL","By Ole Henriksen","4.6 (238 reviews)","2 varieties from $128.00",2018/03/07
"Drunk Elephant T.L.C. Framboos Glycolic Night Serum","By Drunk Elephant","4.5 (1894 reviews)","2 varieties from $90.00",2018/03/07
"Sunday Riley Good Genes Treatment","By Sunday Riley","4.5 (3680 reviews)","2 varieties from $105.00",2018/03/07
"The Ordinary Hyaluronic Acid 2% + B5 1 oz/ 30 mL","By The Ordinary","4.5 (205 reviews)",,2018/03/07
"The Ordinary ""Buffet""","By The Ordinary","4.6 (323 reviews)",,2018/03/07
"Caudalie S.O.S Thirst Quenching Serum a Moisturizing Bubble","By Caudalie","4.5 (943 reviews)","2 varieties from $49.00",2018/03/07
"FARSÁLI Unicorn Essence","By FARSÁLI","4.5 (663 reviews)","2 varieties from $20.00",2018/03/07
"LANEIGE Water Bank Serum","By Laneige","4.5 (1057 reviews)",,2018/03/07
"Ole Henriksen Truth Serum","By Ole Henriksen","4.4 (4987 reviews)","8 varieties from $48.00",2018/03/07
"Drunk Elephant T.L.C. Framboos Glycolic Night Serum","By Drunk Elephant","4.4 (450 reviews)","From $134.00",2018/03/07
"Peter Thomas Roth Water Drench Hyaluronic Cloud Serum","By Peter Thomas Roth","4.6 (366 reviews)","2 varieties from $65.00",2018/03/07
"Rodan and Fields Redefine Night Renewing Serum 60 Caps","By Rodan + Fields","4.6 (255 reviews)","From $99.37",2018/03/07
"The Ordinary Glycolic Acid 7% Toning Solution","By The Ordinary","4.7 (193 reviews)",,2018/03/07
"SUNDAY RILEY C.E.O. Rapid Flash Brightening Serum","By Sunday Riley","4.4 (845 reviews)","From $85.00",2018/03/07
"Est e Lauder Estee Lauder Perfectionist Lifting/Firming Serum 2.5 oz.","By Estée Lauder","4.3 (392 reviews)",,2018/03/07
"Lancôme Advanced Génifique Youth Activating Concentrate Serum","By Lancôme","4.4 (1615 reviews)","16 varieties from $78.00",2018/03/07
"COSRX Advanced Snail 96 Mucin Power Essence","By COSRX","4.7 (301 reviews)","2 varieties from $20.90",2018/03/07
"Origins Original Skin Renewal Serum with Willowherb, 1 oz","By Origins","4.4 (1681 reviews)","From $40.00",2018/03/07
"Caudalie Vinoperfect Radiance Serum 1 oz","By Caudalie","4.3 (2042 reviews)",,2018/03/07
"Estée Lauder Advanced Night Repair Synchronized Recovery Complex II","By Estée Lauder","4.5 (698 reviews)",,2018/03/07
"Origins Plantscription Anti-Aging Serum","By Origins","4.3 (2262 reviews)","6 varieties from $59.00",2018/03/07
"Drunk Elephant C-Firma Day Serum","By Drunk Elephant","4.3 (1214 reviews)","2 varieties from $80.00",2018/03/07
"Caudalie Vinoperfect Complexion Correcting Radiance Serum","By Caudalie","4.3 (1064 reviews)","From $79.00",2018/03/07
"Caudalie Radiance Serum The Anti Dark Spot Solution","By Caudalie","4.2 (701 reviews)",,2018/03/07
"OLEHENRIKSEN Truth Serum(R) 0.5 oz/ 15 mL","By Ole Henriksen","4.4 (231 reviews)","From $15.00",2018/03/07
"Ole Henriksen Three Little Wonders","By Ole Henriksen","4.5 (1326 reviews)",,2018/03/07
"Olay Total Effects 7 in 1 Moisturizer + Serum Duo with Sunscreen Broad Spectrum SPF 15, 1.35 fl oz","By Olay","4.3 (547 reviews)",,2018/03/07
"Estée Lauder Advanced Night Repair Synchronized Recovery Complex II Duo","By Estée Lauder","4.5 (883 reviews)",,2018/03/07
"Olay Total Effects Instant Soothing Serum","By Olay","4.2 (1458 reviews)",,2018/03/07
"Missha Time Revolution The First Treatment Essence","By Missha","4.5 (461 reviews)",,2018/03/07
"Shiseido Ultimune Power Infusing Concentrate","By Shiseido","4.4 (1123 reviews)","10 varieties from $37.00",2018/03/07
"FARSÁLI Rose Gold Elixir","By FARSÁLI","4.6 (154 reviews)",,2018/03/07
"The Ordinary Niacinamide 10% + Zinc 1% 1 oz/ 30 mL","By The Ordinary","4.3 (224 reviews)",,2018/03/07
"Origins Original Skin Renewal Serum 1.7 oz","By Estée Lauder","4.4 (187 reviews)",,2018/03/07
"Murad Sensitive Skin Soothing Serum","By Murad","4.4 (776 reviews)","5 varieties from $57.00",2018/03/07
"Olay Total Effects Moisturizer + Serum Duo with Broad Spectrum SPF 15","By Olay","4.3 (237 reviews)","From $16.18",2018/03/07
"The Ordinary Caffeine Solution 5% + EGCG 1 oz/ 30 mL","By The Ordinary","4.3 (167 reviews)","From $5.80",2018/03/07
"The Ordinary Advanced Retinoid 2% Serum","By The Ordinary","4.6 (276 reviews)",,2018/03/07
"The Ordinary Salicylic Acid 2% Solution","By The Ordinary","4.5 (184 reviews)",,2018/03/07
"Murad Vitamin C Infusion Treatment","By Murad","4.3 (345 reviews)",,2018/03/07
"Ole Henriksen Invigorating Night Transformation(TM) Gel 1.7 oz/ 50 mL","By Ole Henriksen","4.5 (361 reviews)","From $48.00",2018/03/07
"REN Perfect Canvas Skin Finishing Serum","By REN","4.4 (264 reviews)","From $55.00",2018/03/07
"Perricone MD Cold Plasma+ Face","By Perricone MD","4.2 (385 reviews)","From $149.00",2018/03/07
"Olay Age Defying 2-in-1 Anti-Wrinkle Day Cream + Serum","By Olay","4.1 (177 reviews)",,2018/03/07
"Olay Age Defying 2-in-1 Anti-Wrinkle Day Cream + Serum","By Olay","4.1 (177 reviews)",,2018/03/07
"Biosilk Silk Therapy Serum","By Biosilk","4.7 (484 reviews)","4 varieties from $11.99",2018/03/07
"Dr. Jart+ Cicapair Tiger Grass Color Correcting Treatment SPF 30","By Dr. Jart+","4.5 (247 reviews)","2 varieties from $18.00",2018/03/07
"Hey Honey Good Morning Honey Silk Facial Serum","By Hey Honey","4.8 (262 reviews)","From $41.00",2018/03/07
"Skin Food Peach Sake Pore Serum 45ml Made in 'Korea [Peach Sake Pore Serum 45ml]","By SKINFOOD","4.4 (186 reviews)","From $16.00",2018/03/07
"Glossier Super Pure","By Glossier","4.5 (324 reviews)","From $28.00",2018/03/07
"Mary Kay TimeWise Replenishing Serum+C","By Mary Kay","4.3 (1280 reviews)",,2018/03/07
"Mario Badescu Vitamin C Serum, 1 oz.","By Mario Badescu","4.6 (267 reviews)","From $45.00",2018/03/07
"Ole Henriksen Pure Truth(TM) Vitamin C Youth Activating Oil 1 oz/ 30 mL","By Ole Henriksen","4.3 (441 reviews)","From $45.00",2018/03/07
"Biossance Squalane + Vitamin C Rose Oil 1 oz/ 30 mL","By Biossance","4.8 (132 reviews)","From $72.00",2018/03/07
"Murad Retinol Youth Renewal Serum","By Murad","4.4 (281 reviews)","From $88.00",2018/03/07
"Vichy Laboratoires Aqualia Thermal Dynamic Hydration Serum","By Vichy Laboratoires","4.4 (916 reviews)","From $22.00",2018/03/07
"Murad Age Spot and Pigment Lightening Gel","By Murad","4.0 (800 reviews)","3 varieties from $15.00",2018/03/07
"Mizon Multi Function Formula Snail Repair Intensive Ampoule","By Mizon","4.4 (893 reviews)","3 varieties from $30.00",2018/03/07
"Clinique Smart™ Custom-Repair Serum","By Clinique","4.4 (1605 reviews)","8 varieties from $59.50",2018/03/07
"Innisfree Green Tea Seed Serum","By Innisfree","4.5 (191 reviews)","2 varieties from $19.56",2018/03/07
"Origins Plantscription Powerful Lifting Concentrate","By Origins","4.4 (361 reviews)","From $62.00",2018/03/07
"Olay Regenerist Regenerating Serum Fragrance-free","By Olay","4.3 (1275 reviews)","13 varieties from $10.39",2018/03/07
"Glossier Super Glow","By Glossier","4.3 (305 reviews)","From $28.00",2018/03/07
"Nip + Fab Dragon's Blood Fix Plumping Serum","By Nip+Fab","4.3 (177 reviews)","3 varieties from $15.76",2018/03/07
"Missha Time Revolution Night Repair Science Activator Ampoule Serum, 1.7 Ounce [Ampoule 50ml]","By Missha","4.5 (182 reviews)",,2018/03/07
"Algenist Power Recharging Night Pressed Serum","By Algenist","4.3 (158 reviews)","From $95.00",2018/03/07
"The Ordinary 100% Plant-Derived Squalane","By The Ordinary","4.6 (139 reviews)",,2018/03/07
"Origins Mega-Bright Dark Spot Correcting Serum","By Origins","4.2 (1665 reviews)",,2018/03/07
"belif Hungarian Water Essence 2.53 oz","By belif","4.4 (183 reviews)","From $42.00",2018/03/07
"Josie Maran 100 Pure Argan Oil and 100 Pure Argan Oil Light Duo","By Josie Maran","4.6 (495 reviews)",,2018/03/07
"Olay Regenerist Eye Lifting Serum","By Olay","4.0 (1887 reviews)","3 varieties from $12.79",2018/03/07
"Olay Regenerist Serum (Fragrance Free) (50ml)","By Olay","4.3 (221 reviews)",,2018/03/07
"First Aid Beauty Ultra Repair Hydrating Serum","By First Aid Beauty","4.4 (284 reviews)","From $36.00",2018/03/07
"NEW Clarins Double Serum The Next Generation","By Clarins","4.4 (180 reviews)",,2018/03/07
"The Ordinary Salicylic Acid 2% Solution 1 oz/ 30 mL","By The Ordinary","4.5 (97 reviews)",,2018/03/07
"Estée Lauder Perfectionist CP+ Wrinkle Lifting Serum Corrector for Lines Wrinkles Age Spots","By Estée Lauder","4.2 (126 reviews)",,2018/03/07
"KORRES Golden Krocus Ageless Saffron Elixir Serum 1.01 oz","By Korres","4.5 (173 reviews)","From $98.00",2018/03/07
"Kate Somerville Wrinkle Warrior 2-in-1 Plumping Moisturizer + Serum","By Kate Somerville","4.5 (177 reviews)","From $95.00",2018/03/07
"tarte Maracuja Bronzing Serum","By tarte","4.2 (1109 reviews)",,2018/03/07
"Caudalie Glow Activating Anti-wrinkle Serum","By Caudalie","4.2 (150 reviews)","From $52.00",2018/03/07
"Murad T-zone Pore Refining 2-ounce Serum","By Murad","4.1 (294 reviews)",,2018/03/07
"Sunday Riley Skin Adrenaline Anti-Aging Concentrate","By Sunday Riley","4.6 (136 reviews)",,2018/03/07
"Algenist GENIUS Liquid Collagen","By Algenist","4.4 (127 reviews)","From $115.00",2018/03/07
"VENN Skincare Age-Reversing All-In-One Concentrate","By Venn Skincare","4.4 (654 reviews)","From $185.00",2018/03/07
"Ole Henriksen Invigorating Night Treatment","By Ole Henriksen","4.3 (489 reviews)",,2018/03/07
"Origins Three Part Harmony Oil-Infused Serum, 1 oz","By Origins","4.4 (112 reviews)","From $69.00",2018/03/07
"Glossier Super Bounce","By Glossier","4.4 (222 reviews)","From $28.00",2018/03/07
"Elizabeth Arden Visible Difference Optimizing Skin Serum","By Elizabeth Arden","4.3 (220 reviews)",,2018/03/07
"Vichy LiftActiv Serum 10 Supreme","By Vichy Laboratoires","4.3 (567 reviews)","From $34.00",2018/03/07
"KORRES Wild Rose Brightening Targeted Tone Corrector 1.01 oz","By Korres","4.2 (188 reviews)","From $43.00",2018/03/07
"Supergoop! City Sunscreen Serum for Travel","By Supergoop!","4.2 (815 reviews)",,2018/03/07
"PIXI Overnight Glow Serum 30ml","By Pixi","4.6 (109 reviews)","From $26.00",2018/03/07
"Receive a Free Gift Box with purchase of Dr. Andrew Weil for Origins Mega-Bright Serum & Dark Circle Minimizer","By Origins","4.7 (97 reviews)",,2018/03/07
"Olay - Regenerist Micro-Sculpting Super Serum (New) 50ml","By Olay","4.1 (131 reviews)",,2018/03/07
"Algenist Genius Ultimate Anti-Aging Vitamin C+ Serum","By Algenist","4.2 (160 reviews)","From $118.00",2018/03/07
"Laneige Water Bank Essence_EX for Smooth and Clear Skin Texture","By Laneige","4.4 (176 reviews)","From $37.51",2018/03/07
"Clinique Repairwear Laser Focus Wrinkle & UV Damage Corrector","By Clinique","4.3 (860 reviews)",,2018/03/07
"Estée Lauder Perfectionist CP+ Wrinkle Lifting Serum Night Care","By Estée Lauder","4.4 (86 reviews)",,2018/03/07
"MISSHA Time Revolution Night Repair Science Activator Ampoule 50ml","By Missha","4.5 (135 reviews)",,2018/03/07
"Vasanti Brighten Up! Enzymatic Face Rejuvenator With Microderm Exfoliating Crystals","By Vasanti","4.6 (532 reviews)",,2018/03/07
"e.l.f Hydrating Serum","By e.l.f. Cosmetics","4.2 (633 reviews)","2 varieties from $8.25",2018/03/07
"Perricone MD Cold Plasma Face","By Perricone MD","4.2 (365 reviews)","From $229.00",2018/03/07
"IT Cosmetics Bye Bye Lines Serum(TM) Advanced Anti-Aging Wrinkle-Smoothing Miracle Concentrate 1 oz","By IT Cosmetics","4.4 (232 reviews)","From $42.90",2018/03/07
"Tatcha Gold Camellia Beauty Oil","By Tatcha","4.7 (164 reviews)","2 varieties from $95.00",2018/03/07
"bliss Active 99.0 Anti-Aging Series Essential Active Serum","By Bliss","4.2 (66 reviews)","From $160.00",2018/03/07
"Josie Maran Pure Argan Milk Intensive Hydrating Treatment","By Josie Maran","4.4 (249 reviews)",,2018/03/07
"Olay Regenerist Advanced Anti-Aging Micro-Sculpting Serum","By Olay","4.2 (164 reviews)","From $14.99",2018/03/07
"Elizabeth Arden Skin Illuminating Brightening Day Serum With Advanced MI Concentrate","By Elizabeth Arden","4.4 (266 reviews)","From $55.00",2018/03/07
"e.l.f. Beauty Shield Vitamin C Pollution Prevention Serum","By e.l.f. Cosmetics","4.5 (223 reviews)",,2018/03/07
"Lancôme Visionnaire Serum","By Lancôme","4.6 (124 reviews)",,2018/03/07
"Olay Regenerist Regenerating Serum Fragrance Free","By Olay","4.4 (123 reviews)","From $69.98",2018/03/07
"KORRES Golden Krocus Ageless Saffron Elixir Serum Limited Edition 1.01 oz/ 30 mL","By Korres","4.6 (180 reviews)",,2018/03/07
"Olay Professional Pro-X Skin Tightening Serum","By Olay","4.1 (897 reviews)",,2018/03/07
"Origins Dr. Weil For Origins(TM) Mega-Mushroom Skin Relief Advanced Face Serum","By Origins","4.3 (648 reviews)","2 varieties from $55.00",2018/03/07
"Caudalie Premier Cru The Elixir","By Caudalie","4.4 (359 reviews)",,2018/03/07
"Shiseido Benefiance WrinkleResist24 Collection","By Shiseido","4.5 (188 reviews)","2 varieties from $76.00",2018/03/07
"Murad Advanced Acne & Wrinkle Reducer","By Murad","4.2 (488 reviews)","From $52.00",2018/03/07
"Estée Lauder Advanced Night Repair Set","By Estée Lauder","4.3 (197 reviews)",,2018/03/07
"bareMinerals SKINLONGEVITY™ Vital Power Infusion","By bareMinerals","4.5 (90 reviews)","From $38.00",2018/03/07
"The Ordinary Lactic Acid 5% + HA 2%","By The Ordinary","4.6 (96 reviews)",,2018/03/07
"Dear, Klairs Freshly Juiced Vitamin Drop","By Dear, Klairs","4.4 (95 reviews)","From $19.55",2018/03/07
"Perricone MD Vitamin C Ester Serum 1 oz","By Perricone MD","4.4 (201 reviews)","From $105.00",2018/03/07
"Olay Regenerist Micro Sculpting Serum","By Olay","4.1 (890 reviews)",,2018/03/07
"The Ordinary Retinol 1%","By The Ordinary","4.4 (89 reviews)",,2018/03/07
"CeraVe Skin Renewing Serum, 1 oz","By CeraVe","4.4 (125 reviews)","From $13.12",2018/03/07
"Algenist Retinol Firming & Lifting Serum","By Algenist","4.2 (213 reviews)","From $98.00",2018/03/07
"Caudalie Vinexpert Anti-Ageing Serum Eyes & Lips","By Caudalie","4.4 (279 reviews)",,2018/03/07
"Murad Rapid Collagen Infusion","By Murad","4.3 (297 reviews)","3 varieties from $84.00",2018/03/07
"Derma E Vitamin C Concentrated Serum Derma-E 2 oz Liquid","By Derma E","4.6 (86 reviews)","From $19.49",2018/03/07
"Caudalie Vinexpert Firming Serum","By Caudalie","4.3 (276 reviews)",,2018/03/07
"Olay Regenerist Wrinkle Reduction Serum 50ml/1.7oz","By Olay","4.0 (104 reviews)","From $19.99",2018/03/07
"Olay Pro-X Eye Restoration Complex Trial Size 0.3 oz. Box","By Olay","4.1 (878 reviews)",,2018/03/07
"Benefit Cosmetics Instant Comeback Facial Serum","By Benefit Cosmetics","4.5 (126 reviews)","From $46.00",2018/03/07
"Dr. Andrew Weil for Origins Mega-Bright Skin tone correcting serum 1.7OZ/50 ML","By Origins","4.4 (165 reviews)",,2018/03/07
"Korres Natural Products Wild Rose Firming and Brightening Serum","By Korres","4.2 (329 reviews)","2 varieties from $48.00",2018/03/07
"Olay Age Defying Instant Hydration Serum","By Olay","4.2 (2285 reviews)",,2018/03/07
"Murad Perfecting Serum","By Murad","4.3 (455 reviews)",,2018/03/07
"Murad Advanced Active Radiance Serum","By Murad","4.2 (180 reviews)",,2018/03/07
"Dr. Andrew Weil for Origins Mega-Mushroom Skin Relief Advanced Face Serum","By Origins","4.3 (715 reviews)",,2018/03/07
"Vichy Laboratoires Aqualia Thermal Serum Fortifying & Soothing 24hr Hydrating Concentrate","By Vichy Laboratoires","4.5 (509 reviews)",,2018/03/07
"philosophy time in a bottle 100% in control daily age-defying serum","By philosophy","4.3 (246 reviews)","12 varieties from $76.00",2018/03/07
"Manuka Doctor ApiClear Skin Treatment Serum 30ml","By Manuka Doctor","5.0 (1 reviews)",,2018/03/07
"Murad Environmental Shield Active Radiance Serum","By Murad","4.2 (428 reviews)","From $90.00",2018/03/07
"Elizabeth Arden Good Morning Skin Serum, 0.5-Ounce Container","By Elizabeth Arden","4.4 (247 reviews)",,2018/03/07
"Elizabeth Arden New Prevage City Smart SPF 50 Lotion","By Elizabeth Arden","4.5 (186 reviews)","From $55.00",2018/03/07
"Peter Thomas Roth Glycolic Acid 10% Hydrating Gel","By Peter Thomas Roth","4.4 (127 reviews)",,2018/03/07
"Olay Regenerist Micro-Sculpting Serum - 2 50ml/1.7oz. Bottles","By Olay","4.2 (840 reviews)",,2018/03/07
"Algenist Drop & Glow Luminizing Duo","By Algenist","4.7 (90 reviews)",,2018/03/07
"Korres Black Pine Firming, Lifting & Antiwrinkle Serum 1.01 oz","By Korres","4.4 (145 reviews)",,2018/03/07
"Mario Badescu Anti Acne Serum","By Mario Badescu","4.2 (38 reviews)",,2018/03/07
"Olay Regenerist Revitalising Serum","By Olay","4.3 (88 reviews)","From $41.24",2018/03/07
"Vichy Laboratoires Idealia Life Serum, 1 fl oz","By Vichy Laboratoires","4.3 (711 reviews)",,2018/03/07
"Murad Matte Effect Blotting Perfector 0.4 oz","By Murad","4.3 (188 reviews)","From $39.00",2018/03/07
"Origins by Origins Youthtopia Age-Correcting Serum with Rhodiola --/1OZ","By Origins","4.2 (732 reviews)",,2018/03/07
"Murad Active Radiance Serum","By Murad","4.4 (371 reviews)",,2018/03/07
"Nip + Fab Glycolic Fix Serum","By Nip+Fab","4.4 (101 reviews)","From $12.21",2018/03/07
"Elizabeth Arden Ceramide Skincare Youth Restoring Serum","By Elizabeth Arden","4.5 (248 reviews)",,2018/03/07
"The Ordinary Natural Moisturizing Factors + HA 1 oz/ 30 mL","By The Ordinary","4.5 (66 reviews)","From $4.90",2018/03/07
"Murad Age-Diffusing Serum","By Murad","4.2 (346 reviews)","5 varieties from $74.00",2018/03/07
"Biossance The Revitalizer","By Biossance","4.7 (145 reviews)",,2018/03/07
"The Ordinary The No-Brainer Set","By The Ordinary","4.6 (60 reviews)",,2018/03/07
"Peter Thomas Roth Cucumber De-Tox Hydrating Serum, 1 fl oz","By Peter Thomas Roth","4.4 (181 reviews)",,2018/03/07
"Elizabeth Arden New Superstart Skin Renewal Booster","By Elizabeth Arden","4.5 (202 reviews)","From $60.00",2018/03/07
"Caudalie Premier Cru The Serum","By Caudalie","4.3 (73 reviews)","From $150.00",2018/03/07
"Dove Intensive Nourishing Lotion Dry Skin Nutri-serum with Vitamins","By Dove","4.4 (121 reviews)",,2018/03/07
"Vichy Laboratoires Lift Active Serum 10","By Vichy Laboratoires","4.3 (452 reviews)",,2018/03/07
"FARSÁLI Volcanic Elixir","By FARSÁLI","4.3 (99 reviews)",,2018/03/07
"SHISEIDO Sengansenka Perfect Oil Cleansing Makeup","By Shiseido","4.3 (204 reviews)",,2018/03/07
"Caudalie Pulpe VitaminÃ©e Anti-Wrinkle Serum","By Caudalie","4.3 (232 reviews)",,2018/03/07
"The Ordinary Buffet 1 oz/ 30 mL","By The Ordinary","4.5 (66 reviews)","From $12.70",2018/03/07
"Clinique Even Better Clinical™ Dark Spot Corrector & Optimizer","By Clinique","4.1 (349 reviews)","10 varieties from $49.50",2018/03/07
"Vichy LiftActiv Serum 10 Eyes & Lashes - 15 ml","By Vichy Laboratoires","4.3 (447 reviews)","From $25.00",2018/03/07
"Olay Regenerist Micro-Sculpting Serum","By Olay","4.3 (192 reviews)","3 varieties from $9.89",2018/03/07
"NEW! Clarins Hydra-Essentiel Bi-phase Serum","By Clarins","4.1 (259 reviews)",,2018/03/07
"Skinfood - Yuja Water C Whtiening Ampoule In Serum 44ml","By SKINFOOD","4.5 (64 reviews)","From $26.51",2018/03/07
"Peter Thomas Roth Un-Wrinkle Turbo Face Serum","By Peter Thomas Roth","4.5 (105 reviews)","From $150.00",2018/03/07
"Estée Lauder Clear Difference Advanced Blemish Serum","By Estée Lauder","4.3 (66 reviews)",,2018/03/07
"Elizabeth Arden Bye Lines Anti-Wrinkle Serum 1 oz","By Elizabeth Arden","4.1 (188 reviews)",,2018/03/07
"Equitance Brightening Serum & Spot Corrector","By Equitance","4.2 (358 reviews)",,2018/03/07
"Bioré Biore Skin Boosting Night Serum","By Bioré","3.9 (95 reviews)",,2018/03/07
"Estée Lauder Perfectionist Pro Instant Wrinkle Filler Tri-Polymer Blend","By Estée Lauder","4.5 (71 reviews)","From $54.00",2018/03/07
"Elizabeth Arden Ceramide Capsules Daily Youth Restoring Serum","By Elizabeth Arden","4.5 (231 reviews)",,2018/03/07
"Vaseline® Intensive Care™ Advanced Relief Healing Serum","By Vaseline","4.4 (470 reviews)","2 varieties from $6.49",2018/03/07
"Vichy Laboratoires LiftActiv CxP Total Anti-Wrinkle and Firming Serum-Care + Spectacular Radiance","By Vichy Laboratoires","4.4 (409 reviews)",,2018/03/07
"The Ordinary Vitamin C Suspension 23% + HA Spheres 2% 1 oz/ 30 mL","By The Ordinary","4.1 (68 reviews)",,2018/03/07
"L'Oréal Paris Kerastase Reflection Luminous Softening Leave In Essence","By Kérastase","4.5 (301 reviews)",,2018/03/07
"Origins Plantidote Mega-Mushroom Face Serum (Limited Edition) 30ml/1oz","By Origins","4.3 (276 reviews)",,2018/03/07
"Elizabeth Arden PREVAGE Face Serum Holiday Set","By Elizabeth Arden","4.5 (182 reviews)",,2018/03/07
"Elizabeth Arden Overnight Success Renewal Serum, 1 ounce Box","By Elizabeth Arden","4.4 (305 reviews)",,2018/03/07
"Boots No7 Protect & Perfect ADVANCED Serum","By Boots","4.2 (405 reviews)","12 varieties from $24.99",2018/03/07
"Origins Plantscription Anti-Aging Power Serum","By Origins","4.4 (93 reviews)",,2018/03/07
"Murad Sleep Reform Serum 1 fl oz (30 ml)","By Murad","4.4 (176 reviews)",,2018/03/07
"Estée Lauder Idealist Pore Minimizing Skin Refinisher","By Estée Lauder","4.5 (268 reviews)","8 varieties from $58.00",2018/03/07
"Murad Luminous Essence, 50ml","By Murad","4.4 (175 reviews)","From $60.00",2018/03/07
"Estee Lauder .24 oz / 7 ml Promo Travel Size Perfectionist Cp+ Serum","By Estée Lauder","4.2 (61 reviews)",,2018/03/07
"Vaseline® Intensive Care™ Radiance Restore Healing Serum","By Vaseline","4.4 (565 reviews)","2 varieties from $6.83",2018/03/07
"Caudalie Polyphenol C15 Anti-Wrinkle Defense Serum, 1 oz","By Caudalie","4.2 (363 reviews)",,2018/03/07
"Age Defying 2-in-1 Anti-wrinkle Day Cream + Serum","By Olay","4.3 (891 reviews)","From $11.97",2018/03/07
"Murad Intensive Age Diffusing Serum","By Murad","4.2 (170 reviews)",,2018/03/07
"Elizabeth Arden Flawless Future Ceramide Caplet Serum","By Elizabeth Arden","4.5 (183 reviews)","From $38.88",2018/03/07
"Elizabeth Arden Prevage Anti-Aging Plus Intensive Repair Daily Serum","By Elizabeth Arden","4.4 (187 reviews)","From $230.00",2018/03/07
"Laneige Bright Renew Original Serum - 40 ml","By Laneige","4.3 (164 reviews)",,2018/03/07
"Estée Lauder Perfectionist Pro Rapid Firm Lift Treatment with Acetyl Hexapeptide-8","By Estée Lauder","4.5 (59 reviews)","From $75.00",2018/03/07
"Clinique All About Eyes Serum De-Puffing Eye Massage 0.5 oz","By Clinique","4.3 (196 reviews)","From $30.00",2018/03/07
"Elizabeth Arden PREVAGE Eye Advance Anti-aging Serum","By Elizabeth Arden","4.4 (179 reviews)",,2018/03/07
"Juice Beauty Blemish Clearing Serum","By Juice Beauty","4.2 (112 reviews)","From $24.00",2018/03/07
"Murad Age Reform Complete Reform","By Murad","4.2 (168 reviews)","From $78.00",2018/03/07
"The Ordinary Alpha Arbutin 2% + HA","By The Ordinary","4.4 (85 reviews)",,2018/03/07
"Origins Dr. Andrew Weil for Origins® Mega-Bright Skin Tone Correcting Serum 1 oz","By Origins","4.3 (169 reviews)",,2018/03/07
"Elizabeth Arden PREVAGE Anti-Aging + Intensive Repair Daily Serum","By Elizabeth Arden","4.5 (184 reviews)","From $153.41",2018/03/07
"Clarins Booster Energy","By Clarins","4.3 (247 reviews)",,2018/03/07
"Supergoop! City Sunscreen Serum SPF 30 with Soft-Focus Finish 2 oz","By Supergoop!","4.3 (64 reviews)",,2018/03/07
"Clinique Turnaround™ Revitalizing Serum","By Clinique","4.4 (121 reviews)","2 varieties from $44.00",2018/03/07
"Ole Henriksen Enlighten Me Pigment Lightening Serum 1 oz","By Ole Henriksen","4.2 (232 reviews)",,2018/03/07
"Olay Regenerist Regenerating Serum 50ml/1.7oz","By Olay","4.3 (83 reviews)",,2018/03/07
"Olay Age Defying 2-In-1 Anti-Wrinkle Day Cream + Serum 1.7 Fl Oz","By Olay","4.4 (97 reviews)","From $11.37",2018/03/07
"Murad Resurgence(R) Intensive Age Diffusing Serum(TM) 1 oz","By Murad","4.2 (168 reviews)","From $75.00",2018/03/07
"Vichy Idéalia Life Serum Anti-Aging Facial Serum for Visible Pores and Uneven Skin Tone","By Vichy Laboratoires","4.5 (89 reviews)","From $39.00",2018/03/07
"SkinCeuticals C E Ferulic Combination Antioxidant Treatment","By SkinCeuticals","4.5 (89 reviews)","3 varieties from $15.19",2018/03/07
"Peter Thomas Roth Camu Camu Power C x 30 Vitamin C Brightening Serum","By Peter Thomas Roth","4.3 (274 reviews)",,2018/03/07
"Dr. Brandt® 2% Retinol Complex Serum","By Dr. Brandt Skincare","4.6 (114 reviews)","From $69.00",2018/03/07
"The Ordinary Lactic Acid 10% +HA 2%","By The Ordinary","4.5 (73 reviews)",,2018/03/07
"Elizabeth Arden Flawless Future Powered by Ceramide Caplet Serum","By Elizabeth Arden","4.3 (184 reviews)",,2018/03/07
"Neutrogena Rapid Tone Repair Moisturizer Dark Spot Corrector Serum-New Mega Size Package -2 Fluid Ounces","By Neutrogena","4.0 (74 reviews)","From $77.21",2018/03/07
"Origins A Perfect World Age-Defense Skin Guardian Serum With White Tea, 1 oz","By Origins","4.3 (69 reviews)","From $44.00",2018/03/07
"Sunday Riley Juno Transformative Lipid Serum","By Sunday Riley","4.3 (93 reviews)",,2018/03/07
"Caudalie Pulpe Vitaminee 1st Wrinkle Serum","By Caudalie","4.2 (230 reviews)",,2018/03/07
"Clarins Booster Detox","By Clarins","4.3 (288 reviews)","2 varieties from $39.00",2018/03/07
"Mizon Placenta Ampoule Cream","By Mizon","4.3 (172 reviews)","From $10.33",2018/03/07
"Estée Lauder Enlighten Dark Spot Correcting Night Serum","By Estée Lauder","4.3 (136 reviews)","2 varieties from $66.00",2018/03/07
"Meaningful Beauty Crème de Sérum","By Meaningful Beauty(r)","4.3 (177 reviews)","3 varieties from $34.00",2018/03/07
"Algenist Concentrated Reconstructing Serum","By Algenist","4.3 (123 reviews)","2 varieties from $98.00",2018/03/07
"Suave Professionals Split End Rescue Serum","By Suave","4.3 (3 reviews)",,2018/03/07
"Murad Age Reform Intensive Wrinkle Reducer","By Murad","4.2 (154 reviews)","From $150.00",2018/03/07
"Neutrogena® Rapid Wrinkle Repair® Serum","By Neutrogena","4.1 (288 reviews)","From $16.99",2018/03/07
"MURAD Age Diffusing Serum MURA","By Murad","4.3 (163 reviews)",,2018/03/07
"Olay Regenerist 3 Point Super Serum","By Olay","4.2 (87 reviews)",,2018/03/07
"OLEHENRIKSEN Invigorating Night Transformation Gel","By Ole Henriksen","4.5 (58 reviews)","From $79.00",2018/03/07
