

"Control Corrective Crystal-C Serum (1 oz.)","By Control Corrective","5.0 (2 reviews)","From $43.00",2018/03/07
"Rituals Intense Moisture Serum","By Rituals","5.0 (2 reviews)","From $45.00",2018/03/07
"Elizabeth Arden PRO Cellular Recovery Serum","By Elizabeth Arden","4.7 (3 reviews)",,2018/03/07
"Opal Anti-Aging Sea Serum & Applicator - 1 oz Serum","By Clarisonic","3.3 (4 reviews)",,2018/03/07
"GO Ginger Face Serum","By GO","3.0 (1 reviews)","From $20.70",2018/03/07
"Shiseido AQUALABEL Face Care Moisture Serum , Aqua Effector WT 130ml","By Shiseido","4.0 (2 reviews)",,2018/03/07
"Manuka Doctor Apirefine Gold Dust Firming Serum","By Manuka Doctor Skincare","5.0 (3 reviews)","From $39.95",2018/03/07
"Amarte Overnight Express Therapy","By Amarte","4.0 (2 reviews)",,2018/03/07
"Alaffia - Sesame Oil Facial Serum - 0.5 oz.","By Alaffia","4.0 (3 reviews)",,2018/03/07
"Reviva Labs - Under-Eye Dark Circle Serum - 1 oz.","By Reviva Labs","2.4 (5 reviews)","From $18.99",2018/03/07
"Skinn Cosmetics Overnight Pore Reducing Serum 1.25oz","By Skinn Cosmetics","5.0 (2 reviews)",,2018/03/07
"Rodial Dragon's Blood Advanced Xxl Sculpting Serum","By Rodial Skincare","4.0 (2 reviews)","From $153.03",2018/03/07
"Hylamide SubQ Eyes Advanced Serum","By Hylamide","4.0 (2 reviews)",,2018/03/07
"Clarins White Plus Total Luminescent Intensive Brightening Serum","By Clarins","4.0 (2 reviews)",,2018/03/07
"SHISEIDO WHITE LUCENT INTENSIVE SPOT TARGETING SERUM+ FULL SIZE 15 ml / 0.5 oz.","By Shiseido","4.7 (3 reviews)",,2018/03/07
"Shiseido Japan HAKU Melanofocus CR Whitening Essence Serum 45g Refill Bottle","By Shiseido","4.5 (2 reviews)",,2018/03/07
"Dermapeutics Sonoma Naturals Marula Oil Serum - 1 fl. oz.","By Dermapeutics","4.5 (2 reviews)","From $29.98",2018/03/07
"Elemis Absolute Vitamin C Harmony Booster Serum","By Elemis","4.0 (4 reviews)",,2018/03/07
"Bioelements Plump Start","By Bioelements","4.5 (2 reviews)","2 varieties from $35.04",2018/03/07
"L'Occitane Pivoine Sublime Perfecting Essence","By L'Occitane","5.0 (2 reviews)","From $49.00",2018/03/07
"Dr. Lewinn by Kinerase Tone Perfecting Serum XK","By Kinerase","4.5 (2 reviews)","From $29.97",2018/03/07
"WiseNaturals - The Best Vitamin C Serum 20%","By WiseNaturals","2.0 (1 reviews)","From $14.52",2018/03/07
"Alpha Hydrox Intensive Serum 14 Percent Glycolic AHA","By Alpha Hydrox","5.0 (2 reviews)","From $18.97",2018/03/07
"Luzern Laboratories Serum Absolut - Control 1 oz.","By Luzern Laboratories","4.5 (2 reviews)",,2018/03/07
"Clarins Renew Plus Body Serum for Unisex","By Clarins","4.0 (1 reviews)","From $65.00",2018/03/07
"Radical Skincare Advanced Peptide Antioxidant Serum 0.5 oz","By Radical Skincare","4.0 (3 reviews)",,2018/03/07
"Phytomer Youth Performance Wrinkle Radiance Serum","By Phytomer","4.0 (3 reviews)",,2018/03/07
"Glycoderma Complete Care System - Rejuvenating Facial Serum 1 oz","By Glycoderma","3.0 (3 reviews)",,2018/03/07
"Jurlique Purely Age-Defying Facial Serum 30ml/1oz","By Jurlique","4.0 (2 reviews)",,2018/03/07
"Skin Authority Super-C Serum","By Skin Authority","5.0 (2 reviews)","From $67.50",2018/03/07
"Odacite 'Ba + S' Baobab-Sarsaparilla Facial Serum Concentrate","By Odacité","5.0 (2 reviews)","From $39.00",2018/03/07
"Sulwhasoo - First Care Activating Serum EX 8ml","By Sulwhasoo","4.5 (2 reviews)",,2018/03/07
"Skin and Co Roma Sicilian Light Serum","By Skin and Co Roma","5.0 (2 reviews)",,2018/03/07
"Christian Dior Dior 'Capture Totale' Haute Nutrition Oil Serum","By Dior","4.5 (2 reviews)","From $165.00",2018/03/07
"Kiss My Face Potent and Pure C The Change","By Kiss My Face","4.5 (2 reviews)","From $13.79",2018/03/07
"Dermactin-TS Collagen Serum Concentrated Anti-Wrinkle Serum Formula Facial Treatment Products","By Dermactin","4.0 (2 reviews)","From $8.62",2018/03/07
"Darphin Ideal Resource Wrinkle Minimizer Perfecting Serum, 30 ml","By Darphin","4.5 (2 reviews)","From $87.11",2018/03/07
"Amore Pacific Time Response Renewal Ampoule","By AmorePacific","5.0 (2 reviews)","From $550.00",2018/03/07
"Kerstin Florian Correcting Hyaluronic Serum","By Kerstin Florian Correcting","5.0 (2 reviews)","From $88.00",2018/03/07
"Beyond Belief ABH Facial Serum","By Beyond Belief","2.3 (3 reviews)",,2018/03/07
"Christian Dior Capture XP Ultimate Deep Wrinkle Correction Night Concentrate","By Dior","4.0 (2 reviews)",,2018/03/07
"StriVectin Hydro-Thermal Deep Wrinkle Serum, 0.9 oz","By StriVectin","4.5 (2 reviews)",,2018/03/07
"Sesderma Acglicolic Liposomal Serum","By Acglicolic","5.0 (1 reviews)","From $36.78",2018/03/07
"Dr. Jart+ Premium Time Returning Serum 1 oz","By Dr. Jart+","4.0 (2 reviews)",,2018/03/07
"Clarins Booster Repair 0.5 oz/ 15 mL","By Clarins","4.0 (2 reviews)","From $39.00",2018/03/07
"G.M. Collin GF Advanced Repair Serum 1 oz","By G.M. Collin","4.0 (2 reviews)","From $102.94",2018/03/07
"BEAUTY PIE™ Super Stem Cell Moisture Shot Serum","By BEAUTY PIE","4.5 (2 reviews)",,2018/03/07
"Medyskin MedyBrow Eyebrow Thickener Serum","By Medyskin","5.0 (1 reviews)",,2018/03/07
"Gatineau Melatogenine Toning Serum - Face & Neck (Salon Size) 10x3.5ml/0.12oz","By Gatineau","5.0 (1 reviews)",,2018/03/07
"Eminence Gooseberry & Blackcurrant Serum 1 oz/30 ml","By Eminence Organic Skin Care","5.0 (1 reviews)",,2018/03/07
"Eminence Organic Skincare Herbal Spot Serum for Problem Skin Types","By Eminence Organic Skin Care","5.0 (1 reviews)","From $36.53",2018/03/07
"Osmosis Pur Medical Skincare Replenish Antioxidant Repair Serum 1oz","By Osmosis Pur Medical Skincare","5.0 (1 reviews)","From $60.00",2018/03/07
"Christian Dior Dior One Essential Skin Boosting Super Serum, Size 1.7 oz","By Dior","4.3 (3 reviews)","From $125.00",2018/03/07
"Christian Dior Capture Lift Reshaping Serum for Women","By Dior","3.3 (3 reviews)",,2018/03/07
"SISLEY Sisleya Global Firming Serum Travel Size 3ml.x5 tubes=15ml./.5oz NIB","By Sisley","3.5 (2 reviews)","From $60.75",2018/03/07
"Super Peptide Anti Aging Serum with Fast Action Brightening","By I'M FABULOUS COSMETICS","3.5 (2 reviews)","From $334.15",2018/03/07
"OTS [Ost] Original Pure Vitamin C20 Serum 30ml","By OTS","4.0 (2 reviews)",,2018/03/07
"Darphin VITALSKIN Anti-fatigue Dynamizing Serum","By Darphin","3.0 (2 reviews)","From $67.31",2018/03/07
"Pur Minerals Get Bright Brightening Serum","By Pur Minerals","2.5 (2 reviews)","From $34.00",2018/03/07
"SkinCeuticals Retexturing Activator Resurfacing & Replenishing Serum 1oz (30ml) (for Women)","By SkinCeuticals","3.8 (6 reviews)","From $64.49",2018/03/07
"Facial Serum","By Just Natural Products","3.0 (1 reviews)","From $31.99",2018/03/07
"Bare Escentuals bareMinerals Multi-Wrinkle Repair Serum","By bareMinerals","4.0 (2 reviews)",,2018/03/07
"SKIN&CO Umbrian Truffle Face Serum","By SKIN&CO","5.0 (1 reviews)","From $39.00",2018/03/07
"Aesop Oil Free Facial Hydrating Serum 100ml/3.62oz","By Aesop","5.0 (1 reviews)",,2018/03/07
"Skin Nutrition Live Phyto Fusion Smoothie","By Skin Nutrition","5.0 (1 reviews)","From $55.00",2018/03/07
"Nature's Gate Organics Forget Your Lines Wrinkle Diffuser Serum","By Nature's Gate","4.5 (2 reviews)","From $16.47",2018/03/07
"Sircuit Cosmeceuticals Sircuit Skin Fixzit+ .5 oz","By Sircuit Cosmeceuticals","4.0 (2 reviews)",,2018/03/07
"Beauty Bridge - Anti-Aging Lifting Serum","By Beauty Bridge","5.0 (1 reviews)",,2018/03/07
"Rodial Skincare Skin Bleach Serum","By Rodial Skincare","5.0 (1 reviews)",,2018/03/07
"Laboratoires Filorga Paris Hydra-Hyal Intense Hydrating Pumpling Concentrate","By Laboratoires Filorga Paris","5.0 (1 reviews)","From $45.00",2018/03/07
"PlexAppeal Skincare Triple Defense Anti Aging Vitamin C Serum with Hyaluronic Acid and Tri-Peptide","By PlexAppeal Skincare","5.0 (1 reviews)","From $30.87",2018/03/07
"Zelens Youth Concentrate Supreme Age-Defying Serum (30ml)","By Zelens","5.0 (1 reviews)","From $147.25",2018/03/07
"DERMAdoctor Kakadu C Serum & Face Creme","By Dermadoctor","4.5 (2 reviews)",,2018/03/07
"Majestic Pure Vitamin C Serum L-ascorbic Acid for Age Spots","By Majestic Pure","4.0 (2 reviews)","From $21.34",2018/03/07
"Lab Series Future Rescue Repair Serum","By Lab Series Skincare For Men","4.5 (2 reviews)","From $47.95",2018/03/07
"Michael Todd Concentrated C Antioxidant Serum | 1 Oz Airless Bottle","By Michael Todd","3.5 (2 reviews)","From $33.84",2018/03/07
"PCA Skin Anti-redness Serum (Phaze 42)","By PCA SKIN","2.8 (4 reviews)","From $39.49",2018/03/07
"Eminence Strawberry Rhubarb Hyaluronic Serum, 1 Fluid Ounce","By Cutting Edge International, LLC","4.5 (2 reviews)","From $33.28",2018/03/07
"La Prairie La Prairie Cellular Hydrating Serum--30Ml/1Oz By La Prairie","By La Prairie","5.0 (1 reviews)",,2018/03/07
"Coenzyme Q10 Serum 1 oz","By Timeless Skin Care","4.5 (4 reviews)","From $18.99",2018/03/07
"Dior Capture Totale Le Sérum-The Refill","By Dior","3.5 (2 reviews)","From $205.00",2018/03/07
"Paula's Choice RESIST Smoothing Primer Serum SPF 30","By Paula's Choice","5.0 (1 reviews)","From $30.00",2018/03/07
"Caolion Freshly Hydro Serum STEP 2","By Caolion","5.0 (1 reviews)",,2018/03/07
"Natura Bisse The Cure Pure Serum 1.0 fl.oz","By Natura Bisse","5.0 (1 reviews)",,2018/03/07
"Oskia Super 16 Serum","By Oskia","5.0 (1 reviews)","From $85.00",2018/03/07
"Skin Chemists 1.01-Oz. Advanced Retinol Serum","By Skin Chemists","5.0 (1 reviews)",,2018/03/07
"ActiFade Upper Eyelid Lift Contouring Serum","By ActiFade","4.5 (2 reviews)",,2018/03/07
"Darphin Hydraskin Intensive Skin-Hydrating Serum","By Darphin","4.7 (3 reviews)","From $34.50",2018/03/07
"CosMedix Radiance Skin Management Serum","By CosMedix","4.5 (2 reviews)","2 varieties from $77.18",2018/03/07
"June Jacobs Redness Diffusing Serum 1 fl oz.","By June Jacobs","4.5 (2 reviews)",,2018/03/07
"ARCONA Booster Defense Serum","By ARCONA","4.5 (2 reviews)","From $70.00",2018/03/07
"Jan Marini Skin Research Transformation Face Serum","By Jan Marini Skin Research","4.3 (3 reviews)","From $102.00",2018/03/07
"C Quench Antioxident Serum","By PCA SKIN","5.0 (2 reviews)","From $35.25",2018/03/07
"gloTherapeutics Cyto-Luxe Serum","By Glo.therapeutics","5.0 (1 reviews)","From $92.76",2018/03/07
"It's Skin Power 10 Formula - VE Effector (Vitamin E Serum) 30ml/1oz","By It's Skin","5.0 (1 reviews)",,2018/03/07
"Laboratoires Filorga Paris Pigment-Perfect Dark Spot Corrector Serum","By Laboratoires Filorga Paris","5.0 (1 reviews)","From $79.00",2018/03/07
"Decleor Aromessence White Brightening Serum","By Decleor","5.0 (1 reviews)",,2018/03/07
"Amore Pacific TIME RESPONSE Skin Renewal Serum, 1.0 oz.","By AmorePacific","5.0 (1 reviews)","From $525.00",2018/03/07
"DermaQuest Dermaclear Serum 1 Oz","By Dermaquest","5.0 (1 reviews)","From $50.46",2018/03/07
"Alaffia Skin Renewal Baobab Oil Facial Serum, 0.5 oz","By Alaffia","5.0 (1 reviews)",,2018/03/07
"Omorovicza Gold Flash Firming Serum 30ml","By Omorovicza","5.0 (1 reviews)","From $215.00",2018/03/07
"Skin Inc. Licorice Serum RELIEVE","By Skin Inc.","5.0 (2 reviews)","From $35.00",2018/03/07
"Derma-nu Miracle Skin Remedies Firming Hyaluronic Acid Serum for Anti-Aging, 1.25 fl. Oz.","By Derma-nu Miracle Skin Remedies","4.0 (2 reviews)",,2018/03/07
"KLAVUU WHITE PEARLSATION Divine Pearl Serum Mist","By KLAVUU","5.0 (2 reviews)",,2018/03/07
"Innisfree - Jeju Lava Seawater Boosting Ampoule 25ml 25ml","By Innisfree","4.5 (2 reviews)","From $26.90",2018/03/07
"Wish Formula - Pore Tightening Serum 16ml 16ml","By Wish Formula","5.0 (1 reviews)","From $17.90",2018/03/07
"Skin Medica TNS Essential Serum","By SkinMedica","5.0 (1 reviews)","From $148.69",2018/03/07
"ELEMIS Pro-Collagen Super System Serum","By Elemis","5.0 (1 reviews)",,2018/03/07
"Goodal Double Bright Intensive Serum","By GOODAL","5.0 (1 reviews)",,2018/03/07
"Nature's Way Hydraplenish Hyaluronic Acid Serum Plus Vitamin C","By Nature's Way","5.0 (1 reviews)","From $23.75",2018/03/07
"Intelligent Nutrients Certified Organic Anti-Aging Serum","By Intelligent Nutrients","5.0 (1 reviews)",,2018/03/07
"GlyMed Plus Age Management Amino Acid Treatment Serum with PC-10 1.69 oz","By Glymed Plus","5.0 (1 reviews)",,2018/03/07
"ELAIA BEAUTY SOLUTIONS Ecocert and USDA Organic Moroccan Argon Oil","By ELAIA BEAUTY SOLUTIONS","5.0 (1 reviews)","From $14.99",2018/03/07
"Jan Marini Age Intervention Face Serum-1 oz","By Jan Marini","5.0 (1 reviews)",,2018/03/07
"Weleda Age Revitalizing Concentrate Serum","By Weleda","4.0 (1 reviews)","From $29.11",2018/03/07
"The Face Shop - Chia Seed Moisture Recharge Serum 50ml 50ml","By The Face Shop","3.4 (5 reviews)","From $19.00",2018/03/07
"Clarins HydraQuench Intensive Serum Bi-Phase","By Clarins","3.5 (2 reviews)",,2018/03/07
"SWANICOCO - Pore Care Tightening Serum 30ml 30ml","By Swanicoco","5.0 (1 reviews)",,2018/03/07
"Super Aqua Intense Hydration Wrinkle Plumper By Guerlain For Unisex - 1 Oz Serum","By Guerlain","5.0 (1 reviews)",,2018/03/07
"The Ordinary Alpha Arbutin 2% + HA 1 oz/ 30 mL","By The Ordinary","5.0 (1 reviews)","From $7.00",2018/03/07
"Agent Nateur Holi Oil Youth Serum","By Agent Nateur","5.0 (1 reviews)","From $120.00",2018/03/07
"Good Skin Smooth-365 Intensive Clarity+Smoothing Peptide Serum","By Good Skin","5.0 (1 reviews)",,2018/03/07
"ila-Spa Face Serum for Glowing Radiance","By ILA","5.0 (1 reviews)","From $110.00",2018/03/07
"Dior Capture Totale Multi-Perfection Radiance Enhancer Serum for Unisex","By Dior","4.0 (2 reviews)",,2018/03/07
"Dr Roebuck's Ultimate Hydrating Serum(R) 1 oz/ 30 mL","By Dr Roebuck's","4.0 (2 reviews)","From $56.00",2018/03/07
"DermaSilk 90 Second Eye Lift Instant Tightening Serum","By DermaSilk","2.7 (3 reviews)",,2018/03/07
"Studio 35 Pro Retinol Deep Wrinkle Serum","By Studio 35","2.3 (3 reviews)",,2018/03/07
"Jurlique Herbal Recovery Advanced Serum","By Jurlique","3.5 (2 reviews)",,2018/03/07
"Clarins Multi-Active Skin Renewal Serum for Unisex","By Clarins","3.0 (2 reviews)",,2018/03/07
"Erborian Yuza Sorbet Featherweight Emulsion 1.7 oz","By Erborian","5.0 (1 reviews)","From $48.00",2018/03/07
"Piping Rock Hyaluronic Acid Serum 1 oz Pump Bottle","By Piping Rock","5.0 (1 reviews)",,2018/03/07
"SLIM EXTREME 3D Super-Concentrated Modeling Bust Serum -TOTAL PUSH-UP EFFECT, New Mega Size Package 400mL","By Eveline Cosmetics","5.0 (1 reviews)","From $40.04",2018/03/07
"Osmosis Skincare Clarify Vitamin A Blemish Serum 1 oz","By Osmosis Skincare","5.0 (1 reviews)",,2018/03/07
"Skinn Cosmetics Bright Side Correcting Serum 3 Oz","By Skinn Cosmetics","5.0 (1 reviews)","From $59.95",2018/03/07
"Lumene Time Freeze Instant Lift Serum","By Lumene","4.0 (2 reviews)","2 varieties from $16.05",2018/03/07
"MyChelle Pure Harmony Serum, for Sensitive Skin, 1 fl oz","By MyChelle","5.0 (1 reviews)",,2018/03/07
"Dermarche Labs BioREWIND(TM) Full-Spectrum Antioxidant Serum AM 1 oz","By Dermarche Labs","5.0 (1 reviews)","From $125.00",2018/03/07
"Dr. Hauschka Dr Hauschka Night Serum 25ml","By Dr. Hauschka Skin Care","3.0 (3 reviews)",,2018/03/07
"Vivite Daily Antioxidant Facial Serum","By Vivite","4.5 (2 reviews)","From $92.65",2018/03/07
"Elemental Herbology Cell Food Protection & Repair Facial Serum","By Elemental Herbology","4.5 (2 reviews)","From $46.00",2018/03/07
"Jack Black Protein Booster Skin Serum","By Jack Black","4.7 (3 reviews)","From $62.00",2018/03/07
"Daggett & Ramsdell Collagen Serum","By Daggett & Ramsdell","4.5 (2 reviews)","2 varieties from $6.95",2018/03/07
"PCA SKIN pHaze 15+ C-Quench Antioxidant Serum","By PCA SKIN","4.5 (2 reviews)","From $40.70",2018/03/07
"Rodial Skincare Glamoxy Snake Serum","By Rodial Skincare","4.5 (2 reviews)","3 varieties from $160.00",2018/03/07
"Rodial Super Acids Daily Azelaic Acid Serum 1 oz","By Rodial Skincare","4.5 (2 reviews)","From $82.50",2018/03/07
"Sonage High Impact Serum","By Sonage","5.0 (2 reviews)","From $65.91",2018/03/07
"PCA Skin Hydrating Serum - 0.25 oz Travel Size","By PCA SKIN","5.0 (1 reviews)","From $16.17",2018/03/07
"VivierSkin C E Peptides Serum","By VivierSkin","5.0 (1 reviews)","From $150.00",2018/03/07
"Banila Co. Miss Flower & Mr. Honey Essence Oil","By Banila Co.","5.0 (1 reviews)","From $10.95",2018/03/07
"Ren Rose O12 Moisture Defence Serum","By REN","5.0 (1 reviews)",,2018/03/07
"Pharamgel Pharma-C Vitamin Treatment","By Pharmagel","4.0 (1 reviews)","From $38.78",2018/03/07
"Decleor Aromessence Excellence Ultra-Regenerating Serum","By Decleor","4.0 (1 reviews)",,2018/03/07
"Andalou Naturals Fruit Stem Cell Revitalize Serum","By Andalou Naturals","4.0 (2 reviews)","From $19.96",2018/03/07
"Baby Quasar Anti-Aging Serum","By Baby Quasar","4.0 (2 reviews)","2 varieties from $80.00",2018/03/07
"Rituals Sensitive Skin Serum","By Rituals","3.0 (2 reviews)","From $49.00",2018/03/07
"NuFACE Lifter Vitamin C & Hyaluronic Acid Serum","By NuFace","5.0 (1 reviews)",,2018/03/07
"ARGOIL Pure Organic Argan Oil for Hair","By ARGOIL","5.0 (1 reviews)","From $29.95",2018/03/07
"Bioelements Hazelnut Oil","By Bioelements","5.0 (1 reviews)","From $39.00",2018/03/07
"Phytomer White Lumination Brightening Serum","By Phytomer","4.0 (1 reviews)","From $101.43",2018/03/07
"belif Classic Essence Increment 1.68 oz","By belif","4.0 (3 reviews)","From $46.00",2018/03/07
"LightStim for Wrinkles with  Collagen Peptide Serum","By LightStim","5.0 (1 reviews)",,2018/03/07
"Lumene Time Freeze Dark Spot Corrector","By Lumene","2.0 (1 reviews)","From $21.92",2018/03/07
"Lira Clinical Pro Lite Serum with PSC","By Lira Clinical","4.5 (2 reviews)","From $38.00",2018/03/07
"Darphin Exquisage Beauty Revealing Serum","By Darphin","3.5 (2 reviews)","2 varieties from $73.72",2018/03/07
"biopelle Retriderm Serum Plus (.075% Retinol), 1 fl oz","By biopelle","5.0 (1 reviews)",,2018/03/07
"bareMinerals Ageless Genius Firming & Wrinkle Smoothing Serum","By bareMinerals","5.0 (1 reviews)","From $60.00",2018/03/07
"Elizavecca - Milky Piggy Hyaluronic Acid 100% Serum 150ml 150ml","By Elizavecca","4.5 (2 reviews)","From $24.61",2018/03/07
"Dior Capture Youth Matte Maximizer Age-Delay Mattifying Serum","By Dior","4.7 (3 reviews)","From $95.00",2018/03/07
"Paula's Choice RESIST Ultra-Light Super Antioxidant Concentrate Serum","By Paula's Choice","5.0 (1 reviews)","From $7.00",2018/03/07
"Banila Co. Miss Flower & Mr Honey Essence Oil 30ml 30ml","By Banila Co.","5.0 (1 reviews)",,2018/03/07
"Seantree sea Ntree - Hyaluron Ampoule 100 100ml 100ml","By Seantree","5.0 (1 reviews)",,2018/03/07
"Brightening Serum","By glo Skin Beauty","5.0 (1 reviews)","From $50.00",2018/03/07
"Aromatherapy Associates Instant Skin Firming Serum 30ml","By Aromatherapy Associates","5.0 (1 reviews)","From $61.00",2018/03/07
"MALIN+GOETZ Replenishing Face Serum","By Malin + Goetz","5.0 (1 reviews)","From $70.00",2018/03/07
"Paula's Choice RESIST Smoothing Primer Serum SPF 30","By Paula's Choice","5.0 (1 reviews)","From $12.00",2018/03/07
"Tu'el Skincare Hydrate Super Serum","By Tu'eL","5.0 (1 reviews)","3 varieties from $49.00",2018/03/07
"Lancer Fade Serum Intense Brightening Complex, 25 mL","By Lancer","5.0 (1 reviews)","From $225.00",2018/03/07
"Grown Alchemist Anti-Oxidant Treatment Serum: Rosehip & Camellia Seed, 20ml","By Grown Alchemist","5.0 (1 reviews)","From $44.00",2018/03/07
"Sothy's Paris Sothys Paris Soothing Sos Serum, .67 oz","By Sothys Paris","5.0 (1 reviews)","From $49.80",2018/03/07
"Dermelect Cosmeceuticals Self-Esteem Beauty Sleep Serum - 1 oz","By Dermelect Cosmeceuticals","5.0 (1 reviews)","From $42.00",2018/03/07
"Le Mieux Derma Relief Serum","By Le Mieux","5.0 (1 reviews)",,2018/03/07
"skinChemists Vitamin Serum","By skinChemists","5.0 (1 reviews)",,2018/03/07
"NATURAL PACIFIC - Fresh Herb Origin Serum 50ml 50ml","By Natural Pacific","3.5 (2 reviews)","From $14.76",2018/03/07
"Aramis Lab Series Max LS Power V Lifting Serum 30ml/1oz","By Aramis","4.0 (1 reviews)","From $81.40",2018/03/07
"JUARA - Clove Flower & Turmeric Anti-Aging Serum","By Juara","4.0 (1 reviews)","From $70.00",2018/03/07
"ERASA XEP-30","By ERASA XEP-30","5.0 (1 reviews)",,2018/03/07
"HYALURONIC ACID SERUM for skin - Deep Moisture Anti Aging Serum for Dry Skin. Plumps","By MaxiZest","5.0 (1 reviews)","From $13.75",2018/03/07
"Paula's Choice RESIST Brightening Essence","By Paula's Choice","5.0 (1 reviews)","From $40.00",2018/03/07
"Lumene Excellent Future Age-Defying & Repairing Serum","By Lumene","4.0 (1 reviews)",,2018/03/07
"Seantree sea Ntree - Snail Premium Ampoule 100 100ml 100ml","By Seantree","4.0 (1 reviews)",,2018/03/07
"Decleor Aromessence Excellence Serum for Unisex","By Decleor","5.0 (1 reviews)",,2018/03/07
"Clarins Shaping Facial Lift Lipo-Drain Serum 50ml/1.7oz","By Clarins","5.0 (1 reviews)",,2018/03/07
"Eminence Citrus & Kale Potent C+E Serum - For All Skin Types 30ml/1oz","By Eminence Organic Skin Care","5.0 (1 reviews)","From $96.20",2018/03/07
"Dr. Jart+ Ctrl-A Speedy Clear Serum 30ml/1oz","By Dr. Jart+","5.0 (1 reviews)",,2018/03/07
"Hanskin - Bio Prism Brightening Alpha Serum 100ml 100ml","By Hanskin","5.0 (2 reviews)","From $31.87",2018/03/07
"2x La Mer The Regenerating Serum .17oz/5ml Sample/Travel Size Pumps, Totals .34oz/10ml","By La Mer","5.0 (1 reviews)","From $45.48",2018/03/07
"The Saem - Power Ampoule Anti-Wrinkle 40ml 40ml","By the SAEM","5.0 (1 reviews)","From $15.11",2018/03/07
"The Saem - Power Ampoule Lifting 40ml 40ml","By the SAEM","5.0 (1 reviews)",,2018/03/07
"Pr Cosmetics Ceretin Serum","By PÜR Cosmetics","5.0 (1 reviews)","From $42.00",2018/03/07
"Derma Pro DermaBo Powder to Serum Anti-Aging Emulsion","By Derma Pro","5.0 (1 reviews)",,2018/03/07
"Sundari Honey and Enzyme Exfoliating Serum","By Sundari","5.0 (1 reviews)","From $44.00",2018/03/07
"Jadience Vitality Anti-Aging Serum","By Jadience","3.5 (2 reviews)","From $31.58",2018/03/07
"4VOO Uber Tech Instant Lift Serum","By 4VOO","5.0 (1 reviews)","From $100.00",2018/03/07
"L'Occitane Harmonie Divine Serum","By L'Occitane","5.0 (1 reviews)","From $229.00",2018/03/07
"Lancaster 365 Cellular Elixir Intense Youth Renewal Serum 30ml/1oz","By Lancaster","4.0 (1 reviews)",,2018/03/07
"Guinot by GUINOT Serum Nutri Cellulaire Face Serum --/1.05OZ - Night Care","By Guinot","5.0 (1 reviews)","2 varieties from $49.66",2018/03/07
"Clarins - HydraQuench Experts: Cream 50ml + Serum 50ml 2 pcs","By Clarins","5.0 (1 reviews)",,2018/03/07
"Innisfree Whitening Pore Synergy Serum 50ml 50ml","By Innisfree","4.3 (4 reviews)","From $40.90",2018/03/07
"IOPE - Hyaluronic Serum 45ml 45ml","By Iope","4.0 (1 reviews)","From $39.81",2018/03/07
"Somme Institute Serum","By Somme Institute","4.0 (1 reviews)","From $92.00",2018/03/07
"Walgreens Daily Regenerating Serum","By Walgreens","4.0 (2 reviews)",,2018/03/07
"I'm From Im from - Ginseng Serum 30ml 30ml","By I'm From","5.0 (1 reviews)","From $27.90",2018/03/07
"Cosmedix Affirm Antioxidant Firming Serum 1 Ounce","By CosMedix","5.0 (1 reviews)","From $56.55",2018/03/07
"Coola ER+ Fresh Relief Face Serum","By COOLA","5.0 (1 reviews)","From $68.00",2018/03/07
"Clarins Hydraquench Intensive Bi-Phase Unisex Serum, 1 Ounce","By Clarins","5.0 (1 reviews)",,2018/03/07
"Pureheals Volcanic Pore Heating Gel","By Pureheals","4.0 (2 reviews)","2 varieties from $22.00",2018/03/07
"skinChemists Wrinkle Killer Snake Serum for Men","By skinChemists","4.0 (1 reviews)","From $83.97",2018/03/07
"Pyunkang Yul - Mositure Serum 100ml 100ml","By Pyunkang Yul","4.0 (1 reviews)","From $24.90",2018/03/07
"Institut Esthederm E.V.E Essential Vital Elements Serum Source 30ml","By Institut Esthederm","5.0 (1 reviews)","From $77.00",2018/03/07
"Tyra Beauty Makeover Your Skin Duo Microdermabrasion + Serum Set","By Tyra Beauty","5.0 (1 reviews)",,2018/03/07
"Jurlique Rose Moisture Plus Daily Moisture Balancing Serum, 1 oz","By Jurlique","5.0 (1 reviews)",,2018/03/07
"VivierSkin 10 Serum","By VivierSkin","5.0 (1 reviews)",,2018/03/07
"Institut Esthederm Molecular Care Intensive Hyaluronic Concentrated Formula Serum 30ml","By Institut Esthederm","5.0 (1 reviews)",,2018/03/07
"TIA'M - My Signature Red C Serum 30ml 30ml","By Tia'm","5.0 (1 reviews)","From $21.90",2018/03/07
"Neal's Yard Rejuvenating Frankincense Facial Serum, 30ml","By Neal's Yard","5.0 (1 reviews)",,2018/03/07
"Bioeffect EGF Serum - Anti-Aging Serum That Works","By Bioeffect","5.0 (1 reviews)",,2018/03/07
"Osmosis Calm Vitamin A Serum for Sensitive Skin","By Osmosis","5.0 (1 reviews)","From $43.52",2018/03/07
"OBAGI Professional-C Serum, 15%, 1 fl oz","By OBAGI","5.0 (1 reviews)",,2018/03/07
"Lira Bio Hydra C Serum","By Lira","5.0 (1 reviews)",,2018/03/07
"Dr.Hauschka Skin Care Dr. Hauschka Skin Care Regenerating Serum, 1 fl oz","By Dr. Hauschka Skin Care","5.0 (1 reviews)","From $90.00",2018/03/07
"Honest Beauty® Younger + Clearer™ Night Serum with Honestly Pure Retinol™","By Honest Beauty","4.8 (4 reviews)",,2018/03/07
"Alchimie Forever Age defying serums","By Alchimie Forever","3.0 (2 reviews)",,2018/03/07
"derma e Evenly Radiant Serum",,"3.5 (2 reviews)","From $20.90",2018/03/07
"YonKa Serum Vital","By Yonka","5.0 (1 reviews)","From $64.13",2018/03/07
"Men's Skin - Biotherm - Homme Force Supreme Youth Architect Serum 50ml/1.69oz","By Biotherm","5.0 (1 reviews)",,2018/03/07
"StriVectin Intensive Illuminating Serum, 1 oz","By StriVectin","5.0 (1 reviews)",,2018/03/07
"L'Occitane Harmonie Divine Serum Refill","By L'Occitane","5.0 (1 reviews)","From $209.00",2018/03/07
"La Prairie Cellular Power Serum","By La Prairie","4.0 (1 reviews)","From $305.00",2018/03/07
"Naturopathica Plant Stem Cell Booster Serum","By Naturopathica","4.0 (1 reviews)",,2018/03/07
"Eve Lom Age Defying Smoothing Treatment","By Eve Lom","4.0 (1 reviews)","From $150.00",2018/03/07
"Germaine de Capuccini - Anti fatigue serum 50ml","By Germaine De Capuccini","4.0 (1 reviews)","From $83.00",2018/03/07
"NIOD Copper Amino Isolate Serum 5.00% 15ml","By Niod","4.0 (1 reviews)","From $130.00",2018/03/07
"Yves Saint Laurent Or Rouge Serum 30ml","By Yves Saint Laurent","5.0 (2 reviews)","From $425.00",2018/03/07
