
"Borghese Creme Extraordinaire Revitalizing Serum 40ml/1.4oz","By Borghese","5.0 (1 reviews)",,2018/03/07
"Biotherm Skin Vivo Reversive Anti-Aging Serum 30ml/1.01oz","By Biotherm","5.0 (1 reviews)",,2018/03/07
"Meaningful Beauty Dark Spot Correcting Treatment","By Meaningful Beauty","5.0 (1 reviews)","From $45.00",2018/03/07
"Laboratoires Filorga Paris C-Recover Radiance Boosting Concentrate","By Laboratoires Filorga Paris","5.0 (1 reviews)","From $79.00",2018/03/07
"Clarins Extra-Firming Tightening Lift Botanical Serum for Unisex","By Clarins","4.5 (2 reviews)",,2018/03/07
"L'Occitane Almond Velvet Serum","By L'Occitane","5.0 (1 reviews)","From $56.00",2018/03/07
"Space Nk Dr. Russo Night Repair Face Serum","By Space Nk","5.0 (1 reviews)",,2018/03/07
"Guerlain Super Aqua Serum Intense Hydration Wrinkle Plumper 30ml/1oz","By Guerlain","5.0 (1 reviews)",,2018/03/07
"Organic Surge Extra Care Intensive Smoothing Serum","By Organic Surge","5.0 (1 reviews)",,2018/03/07
"SWANICOCO - Revol Ampoule Whitening 40ml 40ml","By Swanicoco","5.0 (1 reviews)",,2018/03/07
"SkinCeuticals Serum 20 AOX 30 ml","By SkinCeuticals","3.3 (3 reviews)","From $91.28",2018/03/07
"Goddess Garden Day Undone Sun-Repair Serum","By Goddess Garden","4.0 (1 reviews)","From $14.28",2018/03/07
"Sisley Paris Phyto-Blanc Intensive Lightening Serum","By Sisley","5.0 (2 reviews)","From $355.00",2018/03/07
"Amore Pacific All Day Balancing Care Serum, 2.4 oz.","By AmorePacific","5.0 (1 reviews)","From $200.00",2018/03/07
"Talika Photo Hydra Serum","By Talika","5.0 (1 reviews)","From $39.00",2018/03/07
"Dr. Lewinn by Kinerase Lift & Resculpt Serum XK","By Kinerase","5.0 (1 reviews)",,2018/03/07
"NuGene Universal Serum","By NuGene","5.0 (1 reviews)","From $161.55",2018/03/07
"Dermatologic Cosmetic Laboratories Hydra Boost Finishing Serum","By Dermatologic Cosmetic Laboratories","5.0 (1 reviews)","From $98.00",2018/03/07
"NEOCUTIS Bio-serum Serum Intense Spot Treatment, 0.13oz","By Neocutis","5.0 (1 reviews)",,2018/03/07
"DAYCELL - Re, DNA Propolis Ampoule 15ml 15ml","By Daycell","3.0 (2 reviews)","From $5.56",2018/03/07
"The Face Shop - Calendula Essential Moisture Serum 60ml 60ml","By The Face Shop","4.0 (1 reviews)","From $16.05",2018/03/07
"Beyond Phyto White Ultimate Serum 50ml 50ml","By Beyond","4.0 (1 reviews)","From $47.41",2018/03/07
"Combination Skin Serum Concentrate (Peach + Cypress) 5ml by Odacite","By Odacité","5.0 (1 reviews)","From $27.50",2018/03/07
"CODAGE Serum N.03 Radiance and Energy Serum (30ml)","By Codage","5.0 (1 reviews)","From $73.00",2018/03/07
"Coup D'eclat Lifting Ampoules","By Coup d'Eclat","5.0 (1 reviews)","2 varieties from $10.47",2018/03/07
"C-Vit Radiance Glowing Fluid","By C-Vit","5.0 (1 reviews)","From $29.54",2018/03/07
"MyChelle Ultra Hyaluronic Hydrating Skin Serum","By MyChelle","5.0 (1 reviews)",,2018/03/07
"Goodal Refine Pore Tightening Essence","By GOODAL","4.0 (1 reviews)","From $26.00",2018/03/07
"La Prairie White Caviar Illuminating Serum","By La Prairie","5.0 (2 reviews)","From $326.02",2018/03/07
"LightStim Collagen Peptide Serum","By LightStim","3.5 (2 reviews)","From $50.00",2018/03/07
"Lumene Premium Beauty Rejuvenating Instant Serum","By Lumene","3.5 (2 reviews)",,2018/03/07
"md formulations Vit-A-Plus Anti-Aging serum","By md formulations Vit-A-Plus","3.5 (2 reviews)",,2018/03/07
"Serious Skin Care No. 8 Facial Beauty Serum","By Chom","5.0 (1 reviews)","From $39.99",2018/03/07
"Alpha-H Liquid Gold Intensive Night Repair Serum Special Edition","By Alpha-h","5.0 (1 reviews)","From $51.00",2018/03/07
"Paula's Choice RESIST C15 Super Booster + RESIST Super Antioxidant Concentrate Serum - Complete Duo","By Paula's Choice","5.0 (1 reviews)","From $69.00",2018/03/07
"CosMedix Clarity Blemish Fighting Serum","By CosMedix","4.0 (1 reviews)",,2018/03/07
"CHANEL Le Lift V-Flash, Firming - Anti-Wrinkle Serum","By Chanel","5.0 (2 reviews)","From $100.00",2018/03/07
"Biotherm Skin Vivo Reversive Anti-Aging Serum 50ml/1.69oz","By Biotherm","5.0 (1 reviews)",,2018/03/07
"Eminence Organics Herbal Spot Serum 1 oz/30 ml","By Eminence Organic Skin Care","5.0 (1 reviews)","From $26.78",2018/03/07
"Clarins Super Restorative Serum--30Ml/1Oz By Clarins","By Clarins","5.0 (2 reviews)",,2018/03/07
"Mizani Smooth Guard Serum","By Mizani","4.0 (1 reviews)","From $14.60",2018/03/07
"Erno Laszlo Transphuse Night Serum","By Erno Laszlo","5.0 (1 reviews)","From $200.00",2018/03/07
"Paula's Choice Resist Intensive Wrinkle-Repair Retinol Serum Travel Size (.24oz/7ml)","By Paula's Choice","3.7 (3 reviews)","From $12.00",2018/03/07
"Mineral Fusion Age-Defying Treatment Serum - 1 fl oz","By Mineral Fusion","4.0 (2 reviews)","From $15.99",2018/03/07
"Osmosis Rescue Epidermal Repair Serum","By Osmosis","5.0 (1 reviews)","2 varieties from $65.55",2018/03/07
"KollagenX 24KT Gold Flake Serum for Face","By KollagenX","5.0 (1 reviews)","From $79.95",2018/03/07
"Lierac Phytrel Bust Firmer Ampoules 20x5ml/0.17oz","By Lierac","5.0 (1 reviews)",,2018/03/07
"Elemis Tri-Enzyme Resurfacing Serum 3 (Salon Product) 15ml/0.5oz","By Elemis","3.0 (1 reviews)","2 varieties from $99.00",2018/03/07
"Exuviance - Essentials Kit (Normal/ Combination): Cleansing Gel + Eye Complex + Masque + Evening Complex + Perfect 10 Serum 5pcs","By Exuviance","5.0 (1 reviews)","From $22.71",2018/03/07
"Eminence Organic Skincare C-Gel","By Eminence Organic Skin Care","5.0 (1 reviews)",,2018/03/07
"john masters organics Bearberry Oily Skin Balancing Face Serum","By john masters organics","5.0 (1 reviews)","From $19.21",2018/03/07
"Clarins Hydraquench Intensive Serum Bi Phase for Unisex","By Clarins","5.0 (1 reviews)",,2018/03/07
"Eminence Organics Grape Antioxidant Serum 1 oz/30 ml","By Eminence Organic Skin Care","5.0 (1 reviews)","From $48.00",2018/03/07
"Erno Laszlo Transphuse Day Serum","By Erno Laszlo","5.0 (2 reviews)","From $190.00",2018/03/07
"Isomers Mega-Bright Dark Spot Formula","By Isomers","3.0 (1 reviews)",,2018/03/07
"BeautyProof CellXCell® Lifting + Firming Serum","By Beautyproof","5.0 (1 reviews)",,2018/03/07
"Guinot Time Logic Age Serum Yeux 15ml/0.5oz","By Guinot","4.0 (1 reviews)",,2018/03/07
"Aromatherapy Associates. Mattifying Skin Serum","By Aromatherapy Associates","4.0 (1 reviews)","From $58.00",2018/03/07
"Ganique Brightening Anti-Aging Serum","By Ganique","4.0 (1 reviews)","From $15.60",2018/03/07
"Decleor Aromessence Rose D'Orient Soothing Serum .5 oz/15ml","By Decleor","4.0 (1 reviews)","From $42.49",2018/03/07
"CGF Serum Acure Organics 1 oz Liquid","By Acure Organics","4.0 (1 reviews)","From $17.99",2018/03/07
"Depileve Gold Concentrate Ampoules","By Depilève","2.0 (2 reviews)","From $36.48",2018/03/07
"L'Occitane Immortelle 28 Day Divine Renewal Program 28 x 0.03 oz/ 1 ml","By L'Occitane","5.0 (1 reviews)",,2018/03/07
"BY TERRY Cellularose BRIGHTENING CC LUMI-SERUM - Color Control Radiance Elixir, #4 - Sunny Flash, 30 ml","By BY TERRY","5.0 (1 reviews)","From $61.00",2018/03/07
"GMC Medical Intense Moisture Serum","By General Motors","5.0 (1 reviews)",,2018/03/07
"Derma E: Anti-Wrinkle Vitamin A & E Treatment Oil","By Derma E","4.5 (2 reviews)","From $25.80",2018/03/07
"I'm Fabulous Cosmetics Powerful Volumizing Serum & Skin Filler","By I'M FABULOUS COSMETICS","5.0 (1 reviews)","From $431.25",2018/03/07
"Clinical Care Skin Solutions Silky Serum","By Clinical Care Skin Solutions","5.0 (1 reviews)","From $22.99",2018/03/07
"MyChelle Dermaceuticals Remarkable Retinal Serum","By MyChelle","5.0 (1 reviews)","From $39.73",2018/03/07
"Guerlain Abeille Royale Dark Spot Corrector Pore Minimizer Serum 1 oz","By Guerlain","3.0 (1 reviews)","From $150.00",2018/03/07
"Blossom Jeju Pink Camellia Soombi Essence Serum","By Blossom Jeju","4.0 (1 reviews)",,2018/03/07
"eb5 Anti-Aging Collagen Treatment Serum, 1 fl oz","By eb5","5.0 (1 reviews)","From $13.99",2018/03/07
"Rituals Skin Energy Serum","By Rituals","5.0 (2 reviews)","From $49.00",2018/03/07
"Raw Biology Organic Liquid Facelift Cream with Vitamin C Serum","By Raw Biology","5.0 (1 reviews)","From $37.99",2018/03/07
"biopelle Retriderm Serum Mild (0.5% Retinol), 1 fl oz","By biopelle","5.0 (1 reviews)","From $106.00",2018/03/07
"Repechage Vita Cura Cell Renewal Serum","By Repechage","4.0 (1 reviews)","From $44.97",2018/03/07
"Borghese Age Defying Complex Advanced Serum for Face and Neck","By Borghese","4.0 (1 reviews)","From $21.49",2018/03/07
"Retinol Spa Treatment 2 Ct Masks Boxed Anti-Aging Serum, Case of 24","By Dollar Item Direct","2.0 (3 reviews)",,2018/03/07
"Clarins Supra Super Restorative Serum, DLX Sample, .35 oz.","By Clarins","4.0 (1 reviews)",,2018/03/07
"VERSO SKINCARE Super Facial Serum 1.01 oz","By VERSO SKINCARE","3.0 (2 reviews)","From $120.00",2018/03/07
"BY TERRY Cellularose BRIGHTENING CC LUMI-SERUM - Color Control Radiance Elixir, #3 - Apricot Glow, 30 ml","By BY TERRY","4.0 (1 reviews)","From $61.00",2018/03/07
"L'Occitane Immortelle Precious Serum","By L'Occitane","4.0 (1 reviews)","From $74.00",2018/03/07
"Glotherapeutics Triple Action Serum 30ml/1oz","By Glo.therapeutics","4.0 (1 reviews)",,2018/03/07
"Sulwhasoo Timetreasure Renovating Serum","By Sulwhasoo","4.0 (2 reviews)",,2018/03/07
"iS Clinical C-15 Serum Advance 1 oz","By Is Clinical","3.0 (1 reviews)",,2018/03/07
"Peptide Complex Serum with Hyaluronic Acid by Sieva Skincare - Anti-Aging Skincare Serum for Face that Reduces Wrinkles","By Sieva Skincare","4.0 (2 reviews)","From $18.56",2018/03/07
"LIERAC Paris Luminescence Illuminating Serum Complexion Corrector, 1.0 fl. oz.","By Lierac Paris","4.0 (1 reviews)",,2018/03/07
"ISOMERS Vitamin C-Stem 15% High Potency Serum","By Isomers","4.0 (2 reviews)",,2018/03/07
"Bremenn Dermafactor Overnight Deep Wrinkle Serum 1oz.","By Bremenn Botanicals","4.0 (1 reviews)","From $58.77",2018/03/07
"REN Keep Young And Beautiful Firming & Smoothing Serum (all Skin Types)","By REN","3.0 (1 reviews)",,2018/03/07
"Institut Esthederm Cellular Concentrate Fundamental Serum 0.5oz, 15ml","By Esthederm","3.0 (1 reviews)","From $67.84",2018/03/07
"MyChelle NoTox Anti-Wrinkle Serum (All Skin Types)","By MyChelle","3.0 (1 reviews)",,2018/03/07
"Rodial Pink Diamond Instant Lifting Serum","By Rodial Skincare","4.0 (1 reviews)",,2018/03/07
"Nardo's Natural - Anti-Wrinkle Night Serum - 0.5 oz.","By Nardo's Natural","4.0 (1 reviews)",,2018/03/07
"BY TERRY SERUM DE ROSE YouthfulLift Active Serum","By BY TERRY","3.0 (1 reviews)","From $94.57",2018/03/07
"Eminence Organic Skincare Blackberry Pore Refining Serum for All Skin Types","By Eminence Organic Skin Care","3.0 (1 reviews)","From $31.00",2018/03/07
"L'Occitane en Provence Shea Butter Fabulous Serum","By L'Occitane","4.0 (1 reviews)",,2018/03/07
"Kerastase Elixir Ultime Oleo-Complexe Beautifying Oil Masque","By Kérastase","4.0 (1 reviews)","From $13.93",2018/03/07
"Guerlain Super Aqua Light Intense Hydration Wrinkle Serum Plumper for Unisex","By Guerlain","4.0 (1 reviews)","2 varieties from $180.00",2018/03/07
"MAKE Beauty Moonlight Brightening Serum","By MAKE Beauty","4.0 (1 reviews)",,2018/03/07
"Opi 613707 Manicure Serum","By OPI","3.0 (1 reviews)","From $40.90",2018/03/07
"Etre Belle 10 Caviar-Gold Ampoules","By Etre Belle","4.0 (1 reviews)","From $56.99",2018/03/07
"Image Skincare Ageless Total Anti-Aging Serum with Vectorize-Technology 1.7 Ounce","By Image Skin Care","4.0 (1 reviews)","2 varieties from $41.54",2018/03/07
"Clarins Double Serum Generation 6 Extra Firming Botanical Intensive Care","By Clarins","4.0 (1 reviews)",,2018/03/07
"Clarins Hydraquench Intensive Bi-Phase Unisex Serum","By Clarins","4.0 (1 reviews)",,2018/03/07
"Avalon Organics Essential Lift Lifting Serum","By Avalon Organics","4.0 (1 reviews)",,2018/03/07
"Eve Lom Time Retreat Face Treatment","By Eve Lom","4.0 (1 reviews)",,2018/03/07
"ReLuma Skin Illuminating Anti-Aging Serum 1.1 fl oz.","By Reluma","4.0 (1 reviews)",,2018/03/07
"Skin By Ann Webb Serum, Super Berry, 1 Fluid Ounce","By Skin by Ann Webb","4.0 (1 reviews)",,2018/03/07
"REN Omega 3 Night Repair Serum","By REN","4.0 (1 reviews)",,2018/03/07
"Jouer Daily Clarifying Treatment Oil","By jouer","4.0 (1 reviews)","From $36.00",2018/03/07
"Revision Skincare Vitamin K Serum","By Revision","4.0 (1 reviews)",,2018/03/07
"Decleor Aromessence Slim Effect Draining Contouring Serum","By Decleor","4.0 (1 reviews)","From $46.37",2018/03/07
"Visio Elan™ BEST 3 Peptide Firming Serum With Hyaluronic Acid & Collagen - Lift & Tighten Facial Skin, Neck & Around Eyes - Anti Aging Rejuvenation Improves Elasticity, Wrinkles & Age Spots - For All Skin Types - Visio Elan","By Visio Elan™","5.0 (1 reviews)",,2018/03/07
"SKIN INC Custom Blended Anti-Aging Serum - (0.34 oz / 10 ml)","By Skin Inc.","5.0 (1 reviews)",,2018/03/07
"Clinical Care Calm EFX","By Clinical Care","5.0 (2 reviews)","From $32.75",2018/03/07
"Yalmeh Peerless Beauty YALMEH Best Hyaluronic Acid Serum For Skin,100% Pure-Highest Quality,Facial Moisturizer with Vitamin C + E + MSM ,Anti Aging Serum, Anti Wrinkle, Instant Lift Solution.","By Yalmeh Peerless Beauty","5.0 (1 reviews)",,2018/03/07
"Glytone Anti-Aging Facial Serum","By Glytone","5.0 (1 reviews)","2 varieties from $84.33",2018/03/07
"3LAB h Serum 1oz","By 3lab","5.0 (1 reviews)","From $200.50",2018/03/07
"Naruko Narcissus DNA Repairing Serum","By Naruko","5.0 (1 reviews)","From $19.99",2018/03/07
"Jurlique Herbal Recovery Advanced Serum, 3.3 oz","By Jurlique","5.0 (1 reviews)",,2018/03/07
"ReVive Moisturizing Renewal Serum, 30 ml","By Revive","5.0 (1 reviews)","From $235.00",2018/03/07
"Acai Daily Smoothing Serum Brazilian Blowout 8 ozSerum Unisex","By Acai Daily Smoothing Serum","5.0 (1 reviews)","From $18.90",2018/03/07
"bliss Well Lit Serum Illuminating Fluid","By Bliss","5.0 (1 reviews)","3 varieties from $28.00",2018/03/07
"Sjal Skincare Llc sj&auml;l Bio-Regeneratif Serum Active Energy Lift (30ml)","By Sjal Skincare Llc","5.0 (1 reviews)","From $184.00",2018/03/07
"Dr. Hauschka Regenerating Serum","By Dr. Hauschka Skin Care","5.0 (1 reviews)","From $70.74",2018/03/07
"Ava Anderson Non-Toxic Night Serum","By Ava Anderson Non-Toxic","5.0 (1 reviews)","From $38.99",2018/03/07
"Obagi Crx Normal To Oily Clarifying Serum","By OBAGI","5.0 (2 reviews)",,2018/03/07
"Hada Labo Gokujyun Alpha Serum, 1.1 oz","By Hada Labo","5.0 (1 reviews)","From $24.67",2018/03/07
"Eclos Super Firm Corrective Serum","By Eclos","5.0 (1 reviews)",,2018/03/07
"Shebah Naturals - Best Vitamin C Serum For Your Face & Skin - Clinical Strength 20%","By Shebah Naturals","5.0 (1 reviews)",,2018/03/07
"Lilian Fache Vitamin C Serum","By Lilian Fache","5.0 (1 reviews)","From $19.44",2018/03/07
"Restorsea Renormalizing Serum with Vibransea Complex, 1.0 oz","By Restorsea","2.0 (1 reviews)",,2018/03/07
"Reviva Labs - Lighten & Brighten Dark Spot Serum - 1 oz.","By Reviva Labs","1.0 (1 reviews)","From $12.49",2018/03/07
"Gold Serums Snake Serum","By Gold Serums","3.0 (1 reviews)","From $41.99",2018/03/07
"OPI Manicure Renew Rejuvenating Serum 1.7 oz","By OPI","3.0 (1 reviews)","From $23.03",2018/03/07
"Kaplan MD Neck Sculpting Serum","By Kaplan Md","3.0 (1 reviews)",,2018/03/07
"Oro Gold Vitamin C Serum, 1.0-Ounce","By Oro Gold","3.0 (1 reviews)",,2018/03/07
"Olympian Labs Skin Support Moisturizing Serum For Face And Neck","By none","3.0 (1 reviews)",,2018/03/07
"Green People. Green People Age Defy+ Hydrate & Renew Face & Neck Serum","By Green People.","3.0 (1 reviews)",,2018/03/07
"Shiseido Bio-Performance Lift Dynamic Serum/1.7 oz. - No Color","By Shiseido","3.0 (1 reviews)",,2018/03/07
"Fair & White 1-ounce Brightening Serum","By Labo. Derma","2.0 (1 reviews)",,2018/03/07
"SkinCeuticals C + AHA - 1 Box Of 6 Bottles = (.75 oz./ 22.2 ml.) 3/4 Oz. Two-in-one daytime antioxidant serum for environmental protection and exfoliation.","By SkinCeuticals","2.0 (1 reviews)","From $19.50",2018/03/07
"iQ Derma Resurface Deep Wrinkle Serum 1 fl oz.","By Iq Derma","4.0 (1 reviews)",,2018/03/07
"Duchess Marden Damascena Rose Anti-Wrinkle Serum 1 oz serum","By Duchess Marden","4.0 (1 reviews)",,2018/03/07
"Erno Laszlo TranspHuse Night Serum 1oz","By Erno Laszlo","4.0 (1 reviews)",,2018/03/07
"mama mio Skin Tight Toning Serum","By Mama Mio","4.0 (1 reviews)",,2018/03/07
"vbeaute Undercover Agent Anti-Wrinkle DNA Protecting Serum It Kit Refill","By vbeaute Undercover Agent","4.0 (1 reviews)",,2018/03/07
"NUXE Nuxuriance Anti-Aging Re-Densifying Concentrated Serum","By NUXE","2.5 (2 reviews)","2 varieties from $41.80",2018/03/07
"Andalou Naturals DIY Booster SPF 30 Facial Serum, Unscented, 2 fl oz","By Andalou Naturals","4.0 (1 reviews)","From $15.18",2018/03/07
"Klein Becker StriVectin Hydro-Thermal Bust Beautification Serum 100ml/3.4oz","By Klein Becker","4.0 (1 reviews)",,2018/03/07
"MD Complete Skin Clearing Healthy Skin Accelerator Treatment Serum -","By MD Complete","4.0 (1 reviews)",,2018/03/07
"BY TERRY Serum Terrybly Sunbooster","By BY TERRY","4.0 (1 reviews)","From $70.00",2018/03/07
"Nutricap Lotion (10 ampoules of 5mL each) Brand: Leritone","By Leritone","4.0 (1 reviews)",,2018/03/07
"Lab Series Men's Power Brightening Serum + DR","By Lab Series Skincare For Men","4.0 (1 reviews)","From $56.86",2018/03/07
"Osmosis Clarify 30ml","By Osmosis","4.0 (1 reviews)","From $36.77",2018/03/07
"Orlane Double Size Firming Serum Neck and Décolleté, 3.4 oz.","By Orlane","4.0 (1 reviews)",,2018/03/07
"Obagi Medical Obagi System Professional-C 10% Vitamin C Serum, 1-Ounce Bottle (30ml)","By OBAGI","4.7 (3 reviews)",,2018/03/07
"Freeze 24-7 Skin Blizzard Intensive Hydrating Facial Serum, 1 oz","By Freeze 24/7","4.0 (1 reviews)",,2018/03/07
"Z.Bigatti Re-Storation Rescue Intensive Facial Serum","By Z.Bigatti","4.0 (1 reviews)",,2018/03/07
"HydroPeptide Serum Anti-Wrinkle Cellular Transformation Serum","By HydroPeptide","4.0 (1 reviews)","From $73.00",2018/03/07
"Dr. Jart+ V7 Renewal Serum 1 oz","By Dr. Jart+","3.0 (1 reviews)",,2018/03/07
"Jurlique Herbal Recovery Neck Serum","By Jurlique","3.0 (1 reviews)",,2018/03/07
"SCINIC - Propolis Energy Serum 28ml 28ml","By Scinic","2.0 (1 reviews)","From $14.32",2018/03/07
"NUXE Serum Merveillance Visible Expression Lines","By NUXE","2.0 (1 reviews)",,2018/03/07
"Dr.Hauschka Skin Care Regenerating Serum","By Dr. Hauschka Skin Care","3.0 (1 reviews)",,2018/03/07
"DESERT ESSENCE Organics Pomegranate Face Serum 2 OZ","By Desert Essence","3.0 (1 reviews)",,2018/03/07
"Dermatouch M.E.D. Serum, 1 fl oz","By Dermatouch M.E.D.","3.0 (1 reviews)",,2018/03/07
"Watts Beauty Moisturizing Hyaluronic Acid Advanced Skin Gel","By Watts Beauty","3.0 (1 reviews)","From $15.99",2018/03/07
"Jurlique Purely Age-Defying Facial Serum 1 oz","By Jurlique","3.0 (1 reviews)",,2018/03/07
"Aritaum - Baby Face Ampoule 12pcs Hyaluronic Acid (Blue)","By ARITAUM","2.0 (1 reviews)","From $14.90",2018/03/07
"Glo Therapeutics Triple Action Serum","By Glo.therapeutics","2.0 (1 reviews)","From $58.04",2018/03/07
"Cellex-C Enhancers Lift Effect Serum Neck and Decollete 120ml/4oz","By Cellex-C","2.0 (1 reviews)",,2018/03/07
"Eminence Biodynamic Cornflower Recovery Serum","By Eminence Organic Skin Care","3.0 (1 reviews)","From $42.30",2018/03/07
"NuFACE Mini Facial Toning Device + LIFTER Vitamin C & Hyaluronic Acid Serum","By NuFace","3.0 (1 reviews)",,2018/03/07
"red flower illuminating rose collagen renewal face serum, 1 oz","By red flower","3.0 (1 reviews)","From $86.00",2018/03/07
"mama mio Shrink to Fit serum","By Mama Mio","3.0 (1 reviews)",,2018/03/07
"tures Gate Organics Nature's Gate Organics C For Yourself Vitamin C Texturizing Serum","By tures Gate Organics","3.0 (1 reviews)",,2018/03/07
"Eclos Anti-Aging Cellular Activator Face Serum","By Eclos","3.0 (1 reviews)",,2018/03/07
"Nono no! no! Smooth Rejuvenating Serum 2.0, 1 fl oz","By nono","3.0 (1 reviews)","From $74.99",2018/03/07
"Skin Inc. Daily Dose Serum Bottle Blue 1 oz (empty bottle for custom-blended serums)","By Skin Inc.","3.0 (1 reviews)",,2018/03/07
"Gly Derm Intense C Serum PM Vitamin C Concentrate","By Gly Derm","3.0 (2 reviews)","From $49.50",2018/03/07
"Etre Belle Moisturizing Ampoule","By Etre Belle","2.0 (1 reviews)","From $51.99",2018/03/07
"111SKIN Cryo Energising Body Serum","By none","1.0 (1 reviews)",,2018/03/07
"WEI Jujube Age Control Serum","By WEI","2.0 (1 reviews)",,2018/03/07
"Alpha Hydrox Anti-Wrinkle Intensive Serum, 2 fl oz","By Alpha Hydrox","2.0 (1 reviews)",,2018/03/07
"ARCONA Hydrating Serum, Replenish AM/PM, 1.17 oz","By ARCONA","3.5 (2 reviews)","From $50.00",2018/03/07
"Whish Flawless Post Wax & Shave Serum Swipes 30 CT","By Whish","2.0 (1 reviews)","From $22.00",2018/03/07
"Tria Finishing Serum 1 oz","By Tria","2.0 (1 reviews)","From $65.00",2018/03/07
"pura d'or Vitamin C Serum, 4 Ounce","By Pura D'or","2.0 (1 reviews)","From $19.99",2018/03/07
"Aesop Night Care 3.62 Oz Parsley Seed Anti-Oxidant Serum For Women","By Aesop","2.0 (1 reviews)",,2018/03/07
"Aritaum - Baby Face Ampoule 12pcs Collagen (Pink)","By ARITAUM","1.0 (1 reviews)","From $14.90",2018/03/07
"Shiseido White Lucent Intensive Spot Targeting Serum 0.5 oz","By Shiseido","3.0 (3 reviews)",,2018/03/07
"SkinCeuticals Serum 10 AOX","By SkinCeuticals","1.0 (1 reviews)","From $45.49",2018/03/07
"Clarins Extra-Firming Eye Lift Perfecting Serum","By Clarins","1.0 (1 reviews)","3 varieties from $64.00",2018/03/07
"Osmosis Skincare Replenish Antioxidant Repair Serum","By Osmosis Skincare","1.0 (1 reviews)","From $44.31",2018/03/07
"DermaSilk Double Chin Firming Facial Contouring Serum","By DermaSilk","1.0 (1 reviews)",,2018/03/07
"Face Lift, Youth Serum C, Eye, 0.50-Ounce","By Face Lift","0.0 (0 reviews)",,2018/03/07
