"NIVEA Q10 Plus Anti-Wrinkle Replenishing Pearls","By Nivea","4.3 (159 reviews)",,2018/03/07
"Clarins Booster Repair","By Clarins","4.1 (225 reviews)",,2018/03/07
"Super by Perricone First Blush Brightening Serum 1 oz","By Perricone MD","4.3 (105 reviews)",,2018/03/07
"PIXI Hydrating Milky Serum 30ml","By Pixi","4.5 (70 reviews)","From $26.00",2018/03/07
"Sunday Riley Juno Body Serum","By Sunday Riley","4.4 (92 reviews)",,2018/03/07
"Dermalogica Overnight Repair Serum","By Dermalogica","4.4 (115 reviews)","From $45.31",2018/03/07
"Murad Age Reform Time Release Retinol Concentrate for Deep Wrinkles","By Murad","4.3 (149 reviews)",,2018/03/07
"Shiseido Bio-Performance Glow Revival Serum","By Shiseido","4.4 (103 reviews)","From $89.00",2018/03/07
"Neutrogena® Hydro Boost Hydrating Serum","By Neutrogena","4.5 (79 reviews)","From $14.99",2018/03/07
"Olay Definity Self Repair Serum","By Olay","4.1 (843 reviews)",,2018/03/07
"Shiseido White Lucent MicroTargeting Spot Corrector 1 oz","By Shiseido","4.2 (100 reviews)","From $130.00",2018/03/07
"philosophy help me retinol night treatment","By philosophy","4.5 (94 reviews)","5 varieties from $49.00",2018/03/07
"Shiseido Ibuki Smart Filtering Smoother Serum 0.67 oz/ 20 mL","By Shiseido","4.5 (78 reviews)","From $23.00",2018/03/07
"NIVEA Skin Firming & Smoothing Serum","By Nivea","4.1 (149 reviews)","2 varieties from $11.49",2018/03/07
"Estée Lauder Perfectionist CP+R Wrinkle Lifting/Firming Serum","By Estée Lauder","4.5 (71 reviews)","From $68.00",2018/03/07
"Shiseido Bio-Performance Super Corrective Serum","By Shiseido","4.5 (86 reviews)","2 varieties from $80.00",2018/03/07
"Avene Hydrance Optimale Hydrating Serum","By Avène","4.7 (72 reviews)","2 varieties from $28.41",2018/03/07
"Clinique Anti-Blemish Solutions™ Blemish + Line Correcting Serum","By Clinique","4.5 (57 reviews)",,2018/03/07
"First Aid Beauty Facial Radiance Serum 1 oz","By First Aid Beauty","4.4 (43 reviews)",,2018/03/07
"Dr. Dennis Gross Skincare Ferulic Acid + Retinol Brightening Solution","By Dr. Dennis Gross Skincare","4.5 (65 reviews)","From $88.00",2018/03/07
"Sunday Riley Liquid Diet","By Sunday Riley","4.4 (81 reviews)",,2018/03/07
"Neutrogena® Ageless Intensives® Anti-Wrinkle Deep Wrinkle Serum","By Neutrogena","4.0 (345 reviews)","3 varieties from $15.52",2018/03/07
"Neutrogena® Hydro Boost Renewal Serum","By Neutrogena","4.4 (87 reviews)",,2018/03/07
"Shiseido Future Solution LX Ultimate Regenerating Serum","By Shiseido","4.4 (109 reviews)","2 varieties from $225.00",2018/03/07
"Perricone MD Cold Plasma Anti-Aging Face Treatment 0.25 oz/ 7.5 mL","By Perricone MD","4.2 (87 reviews)",,2018/03/07
"Boots No7 Protect & Perfect Intense Beauty Serum, 1 fl oz","By Boots","4.1 (107 reviews)",,2018/03/07
"Skin Laundry Restoring Night Serum","By Skin Laundry","4.3 (74 reviews)","From $46.00",2018/03/07
"Anastasia Beverly Hills Hydrating Oil","By Anastasia Beverly Hills","4.7 (40 reviews)",,2018/03/07
"Perricone MD Neuropeptide Deep Wrinkle Serum 1 oz","By Perricone MD","4.1 (102 reviews)","From $185.00",2018/03/07
"Estée Lauder Clear Difference Advanced Blemish Serum 70ml","By Estée Lauder","4.3 (39 reviews)",,2018/03/07
"BareMinerals BareSkin Sheer Sun Serum Bronzer","By bareMinerals","4.4 (86 reviews)","From $28.00",2018/03/07
"IT Cosmetics Miracle Water 3-in-1 Glow Tonic","By IT Cosmetics","4.7 (52 reviews)","From $38.00",2018/03/07
"Shiseido White Lucent Brightening Serum for Neck and Décolletage","By Shiseido","4.4 (90 reviews)",,2018/03/07
"Estée Lauder Re-Nutriv Revitalizing Comfort Serum","By Estée Lauder","4.4 (47 reviews)",,2018/03/07
"Shiseido Bio-Performance LiftDynamic Serum 1.7 oz","By Shiseido","4.5 (88 reviews)","From $135.00",2018/03/07
"Korres Quercetin & Oak Antiaging Antiwrinkle & Firming Face Serum 1.01 oz","By Korres","4.2 (88 reviews)",,2018/03/07
"Skinfood - Watery Berry Serum 70ml","By SKINFOOD","4.6 (47 reviews)",,2018/03/07
"The Ordinary Granactive Retinoid* 2% Emulsion 1 oz/ 30 mL","By The Ordinary","4.7 (43 reviews)","From $8.00",2018/03/07
"Shiseido White Lucent Luminizing Surge 2.5 oz","By Shiseido","4.3 (91 reviews)","From $60.00",2018/03/07
"Boots No7 Protect & Perfect Beauty Serum","By Boots","4.4 (95 reviews)",,2018/03/07
"Nourish Organic Argan Face Serum Apricot + Rosehip","By Nourish","4.6 (79 reviews)","From $18.24",2018/03/07
"Perricone MD Acyl-Glutathione Deep Crease Serum 1 oz","By Perricone MD","4.4 (76 reviews)","2 varieties from $185.00",2018/03/07
"Tata Harper Rejuvenating Serum, 50mL","By Tata Harper","4.4 (49 reviews)","From $158.00",2018/03/07
"Estée Lauder Advanced Night Repair Intensive Recovery Ampoules","By Estée Lauder","4.6 (56 reviews)","From $110.00",2018/03/07
"Fresh Rose Deep Hydration Face Serum","By Fresh","4.7 (70 reviews)","From $48.00",2018/03/07
"First Aid Beauty Anti-Redness Serum","By First Aid Beauty","4.0 (102 reviews)","From $36.00",2018/03/07
"First Aid Beauty Dual Repair Power Serum","By First Aid Beauty","4.4 (53 reviews)",,2018/03/07
"Shiseido White Lucent MicroTargeting Spot Corrector 1.6 oz","By Shiseido","4.2 (86 reviews)","From $180.00",2018/03/07
"Origins Dr. Weil Mega-Mushroom Skin Relief Advanced Face Serum, 1.0 Fl. Oz.","By Origins","4.4 (61 reviews)",,2018/03/07
"Vichy - Skin Idealizer Serum 1 pc","By Vichy Laboratoires","4.6 (54 reviews)",,2018/03/07
"Perricone MD No Concealer Concealer","By Perricone MD","4.3 (79 reviews)",,2018/03/07
"Biossance 100% Squalane Oil 3.3 oz/ 100 mL","By Biossance","4.7 (60 reviews)","From $58.00",2018/03/07
"Palmer's Scar Serum","By Palmer's","4.1 (98 reviews)","2 varieties from $14.49",2018/03/07
"SheaMoisture Coconut and Hibiscus Spot Correcting Serum","By SheaMoisture","4.1 (96 reviews)","From $11.99",2018/03/07
"Shiseido Energizing Essence","By Shiseido","4.3 (80 reviews)",,2018/03/07
"Peter Thomas Roth Laser-Free Resurfacer","By Peter Thomas Roth","3.9 (85 reviews)",,2018/03/07
"ITAB Organic Blueberry Herbal Skin Treatment","By ITAB","0.0 (0 reviews)","2 varieties from $85.00",2018/03/07
"Vichy - Face Care Vichy LiftActiv Serum 10 - Youth Enhancing Serum 50ml","By Vichy Laboratoires","4.4 (64 reviews)",,2018/03/07
"KORRES Black Pine 3D Sculpting, Firming & Lifting Face Serum","By Korres","4.4 (73 reviews)","From $75.00",2018/03/07
"Shiseido White Lucency Perfect Radiance Concentrated Brightening Serum 30ml/1oz","By Shiseido","4.2 (82 reviews)",,2018/03/07
"Shiseido Bio-Performance LiftDynamic Serum 1 oz","By Shiseido","4.3 (87 reviews)","From $95.00",2018/03/07
"Shiseido White Lucent Immediate Brightening Set","By Shiseido","4.4 (82 reviews)",,2018/03/07
"Shiseido Bio Performance Super Corrective Serum for Unisex","By Shiseido","4.5 (75 reviews)",,2018/03/07
"Clinique Fresh Pressed™ Daily Booster with Pure Vitamin C 10%","By Clinique","4.5 (64 reviews)","From $19.50",2018/03/07
"Pacifica Moisturize Energize Serum Wipes","By Pacifica","4.3 (86 reviews)",,2018/03/07
"Perricone MD Neuropeptide Face Activator","By Perricone MD","4.3 (72 reviews)","From $105.00",2018/03/07
"L'Oréal Paris Youth Code™ Texture Perfector Serum Concentrate","By L'Oréal Paris","4.3 (72 reviews)","From $18.74",2018/03/07
"Clinique Repairwear Laser Focus Wrinkle & UV Damage Corrector","By Clinique","4.5 (44 reviews)",,2018/03/07
"The Ordinary Vitamin C Suspension 23% + HA Spheres 2%","By The Ordinary","4.0 (51 reviews)",,2018/03/07
"NIVEA Skin Firming & Smoothing Serum","By Nivea","4.2 (71 reviews)","From $9.52",2018/03/07
"Skinfood - Watery Berry Ampoule (Original) 60ml 60 ml","By SKINFOOD","4.6 (39 reviews)",,2018/03/07
"Ole Henriksen The Whole Truth Serum, 3 Count","By Ole Henriksen","4.6 (45 reviews)",,2018/03/07
"First Aid Beauty Anti-Redness Serum 7 x 0.33 oz","By First Aid Beauty","4.0 (49 reviews)",,2018/03/07
"Caudalie Firming Serum 3D Redefinin","By Caudalie","4.4 (50 reviews)","From $82.00",2018/03/07
"Estée Lauder Idealist Even Skintone Illuminator Serum","By Estée Lauder","4.1 (74 reviews)",,2018/03/07
"Dr. Brandt® Do Not Age With Drbrandt Transforming Pearl Serum","By Dr. Brandt Skincare","4.6 (64 reviews)","From $152.00",2018/03/07
"philosophy when hope is not enough facial firming serum","By philosophy","4.5 (77 reviews)","7 varieties from $45.00",2018/03/07
"Ole Henriksen Ultimate Firming Serum, 1 oz.","By Ole Henriksen","4.3 (51 reviews)",,2018/03/07
"Neutrogena® Ageless Intensives® Anti-Wrinkle Deep Wrinkle Serum","By Neutrogena","4.2 (80 reviews)","From $20.99",2018/03/07
"Tata Harper Rejuvenating Serum 1.7 oz","By Tata Harper","4.5 (47 reviews)","From $98.00",2018/03/07
"Mario Badescu Vitamin C Serum","By Mario Badescu","4.6 (39 reviews)",,2018/03/07
"Boots Botanics All Bright Radiance Concentrate Serum, 1 fl oz","By Boots","4.3 (73 reviews)","2 varieties from $18.49",2018/03/07
"Proactiv+ Advanced Dark Spot Correcting Serum","By Proactiv","3.4 (63 reviews)","From $50.00",2018/03/07
"Peter Thomas Roth Radiance Oxygenating Serum","By Peter Thomas Roth","4.4 (67 reviews)",,2018/03/07
"L'Oréal Paris Age Perfect® Cell Renewal Golden Serum","By L'Oréal Paris","4.1 (78 reviews)","From $17.97",2018/03/07
"Estée Lauder Re-Nutriv Ultimate Lift Regenerating Youth Serum","By Estée Lauder","4.5 (39 reviews)","From $305.00",2018/03/07
"Bobbi Brown Extra Repair Serum","By Bobbi Brown","4.7 (40 reviews)","3 varieties from $114.00",2018/03/07
"Lancôme Absolue Ultimate Night Bx Night Serum Intense Night Recovery and Replenishing Moisturizer","By Lancôme","4.5 (49 reviews)",,2018/03/07
"L'Oréal Paris Youth Code™ Dark Spot Correcting & Illuminating Serum Corrector","By L'Oréal Paris","4.4 (70 reviews)","3 varieties from $17.98",2018/03/07
"Shiseido White Lucent Concentrated Brightening Serum 1.8oz./50ml","By Shiseido","4.2 (81 reviews)",,2018/03/07
"Neutrogena® Rapid Tone Repair Dark Spot Corrector","By Neutrogena","3.9 (88 reviews)","From $16.01",2018/03/07
"Perricone MD PRE: EMPT SERIES(TM) Skin Perfecting Serum 1 oz","By Perricone MD","4.7 (46 reviews)","From $90.00",2018/03/07
"Lancôme Absolue Sublime Oleo-Serum","By Lancôme","4.3 (51 reviews)","2 varieties from $192.00",2018/03/07
"Perricone MD Serum Prep 6 oz","By Perricone MD","4.3 (70 reviews)","2 varieties from $160.00",2018/03/07
"SKINFOOD Royal Honey Essential Queen's Serum","By SKINFOOD","4.5 (37 reviews)","2 varieties from $20.94",2018/03/07
"Dr. Brandt® Skincare Dark Spots No More Serum Concentre","By Dr. Brandt Skincare","4.2 (78 reviews)",,2018/03/07
"Estee Lauder Perfectionist CP+ Wrinkle Lifting Serum Corrector 1.7 oz","By Estée Lauder","4.4 (40 reviews)",,2018/03/07
"RoC Retinol Correxion Deep Wrinkle Serum","By RoC","4.3 (63 reviews)","2 varieties from $15.92",2018/03/07
"L'Oréal Paris RevitaLift® Triple Power™ Intensive Skin Revitalizer Serum + Moisturizer","By L'Oréal Paris","4.5 (53 reviews)","From $14.79",2018/03/07
"Perricone MD Acyl-Glutathione Eye Lid Serum 0.5 oz","By Perricone MD","4.1 (81 reviews)","2 varieties from $120.00",2018/03/07
"Clarins Double Serum Complete Age Control Concentrate","By Clarins","4.5 (39 reviews)","2 varieties from $89.00",2018/03/07
"Peter Thomas Roth Retinol Fusion PM Overnight Resurfacing Pads 30 pads","By Peter Thomas Roth","4.6 (50 reviews)","From $52.00",2018/03/07
"L'Oréal Paris Sublime Bronze Self-Tanning Serum","By L'Oréal Paris","3.9 (76 reviews)","From $9.94",2018/03/07
"Peter Thomas Roth Wrinkle X Fast-Acting Serum 1 oz","By Peter Thomas Roth","4.7 (39 reviews)",,2018/03/07
"Peter Thomas Roth Pro at Home Professional Strength 3% Retinoid Plus","By Peter Thomas Roth","4.5 (49 reviews)","From $82.00",2018/03/07
"Clinique Turnaround Concentrate Radiance Renewer","By Clinique","4.5 (31 reviews)",,2018/03/07
"Dr. Dennis Gross Skincare C+ Collagen Brighten & Firm Vitamin C Serum","By Dr. Dennis Gross Skincare","4.4 (45 reviews)","From $78.00",2018/03/07
"Clinique Turnaround Concentrate Visible Skin Renewer","By Clinique","4.5 (33 reviews)",,2018/03/07
"Neutrogena Rapid Tone Repair Moisturizer Dark Spot Corrector Serum, 2 Pack","By Neutrogena","4.0 (80 reviews)","From $67.89",2018/03/07
"Tony Moly - Intense Care Gold 24K Snail Serum 35ml 35ml","By TONYMOLY","4.5 (39 reviews)",,2018/03/07
"L'Oréal Youth Code Dark Spot Serum Corrector","By L'Oréal Paris","3.9 (83 reviews)","From $18.74",2018/03/07
"First Aid Beauty Retinol Serum","By First Aid Beauty","4.5 (55 reviews)","From $58.00",2018/03/07
"Perricone MD Chia Serum 1 oz","By Perricone MD","4.1 (72 reviews)","From $85.00",2018/03/07
"Estee Lauder 'Perfectionist [CP+R]' Wrinkle Lifting/Firming Serum Duo (Limited Edition)","By Estée Lauder","4.5 (40 reviews)","From $165.00",2018/03/07
"Estée Lauder Re-Nutriv Ultimate Lift Age-Correcting Serum 0.16oz, 5ml","By Estée Lauder","4.6 (34 reviews)",,2018/03/07
"Bourjois Fond De Teint Healthy Mix Extension Serum 2ea","By Bourjois","4.5 (49 reviews)","2 varieties from $15.00",2018/03/07
"Paula's Choice RESIST Intensive Wrinkle-Repair Retinol Serum, 1 fl oz","By Paula's Choice","4.7 (45 reviews)","From $39.00",2018/03/07
"Kate Somerville Age Arrest Anti-Wrinkle Serum","By Kate Somerville","4.6 (27 reviews)","From $95.00",2018/03/07
"Dr. Dennis Gross Skincare Clinical Concentrate Hydration Booster","By Dr. Dennis Gross Skincare","4.7 (40 reviews)","From $68.00",2018/03/07
"Clinique Sculptwear™ Lift and Contour Serum for Face and Neck","By Clinique","4.3 (30 reviews)",,2018/03/07
"Dr.Brandt Collagen Serum","By Dr. Brandt Skincare","4.3 (62 reviews)",,2018/03/07
"Yes To Cucumbers Natural After-Sun Serum with Shimmer","By Yes To","4.4 (34 reviews)",,2018/03/07
"L'Oréal Paris RevitaLift® Triple PowerTM Concentrated Serum","By L'Oréal Paris","4.2 (65 reviews)","From $17.97",2018/03/07
"Clinique Pore Refining Solutions Correcting Serum","By Clinique","4.4 (45 reviews)",,2018/03/07
"La Roche-Posay Rosaliac AR Intense Hydrating Facial Serum for Sensitive Skin to Visibly Reduce Redness","By La Roche-Posay","4.6 (54 reviews)","From $39.99",2018/03/07
"H20+ Beauty Infinity+ Renewing Youth Serum, Multi/None","By H2O+ Beauty","4.7 (25 reviews)","From $58.00",2018/03/07
"Algenist Targeted Age Correcting Serum","By Algenist","4.7 (36 reviews)",,2018/03/07
"Shiseido Superior Radiance Serum","By Shiseido","4.8 (48 reviews)","From $225.00",2018/03/07
"Estee Lauder Perfectionist [CP+R] Wrinkle Lifting/Firming Serum (For All Skin Types) - 100ml/3.4oz","By Estée Lauder","4.6 (36 reviews)",,2018/03/07
"Mario Badescu Herbal Hydrating Serum/1 oz.","By Mario Badescu","4.5 (48 reviews)","From $30.00",2018/03/07
"Peter Thomas Roth Camu Camu Power C x 30 Vitamin C Brightening Duo","By Peter Thomas Roth","4.5 (51 reviews)",,2018/03/07
"Clinique Sculptwear Lift and Contour Serum 50ml","By Clinique","4.2 (28 reviews)",,2018/03/07
"Clinique Derma White Clinical Brightening Essence","By Clinique","4.1 (28 reviews)",,2018/03/07
"Estee Lauder Clear Difference Advanced Blemish Serum (Pack of 4, 7ml/0.24oz Each, 28ml/0.96oz Total)","By Estée Lauder","4.8 (24 reviews)",,2018/03/07
"Anastasia Beverly Hills Line Erasing Serum","By Anastasia Beverly Hills","4.6 (42 reviews)",,2018/03/07
"Peter Thomas Roth-VIZ-1000 Intensive Hydrating Acid Complex","By Peter Thomas Roth","4.4 (39 reviews)",,2018/03/07
"SK-II LXP Moist Softening Serum","By SK-II","4.8 (48 reviews)","From $325.00",2018/03/07
"Dr. Brandt® LaserFX Bright Serum","By Dr. Brandt Skincare","4.4 (31 reviews)",,2018/03/07
"Vichy Livtactiv Serum 10 Supreme","By Vichy Laboratoires","4.5 (40 reviews)","From $32.00",2018/03/07
"Mad Hippie Vitamin C Serum","By Mad Hippie","4.6 (43 reviews)","From $24.00",2018/03/07
"Onomie Powerful Priming Serum","By Onomie","4.2 (43 reviews)",,2018/03/07
"Clarins Truly Matte Pore Minimizing 1-ounce Serum","By Clarins","4.1 (60 reviews)","From $54.00",2018/03/07
"Garnier Skin Naturals Ultra Lift and Serum Cream 50ml","By Garnier","3.8 (53 reviews)","From $17.00",2018/03/07
"Tony Moly - The Black Tea London Classic Serum 100ml 100ml","By TONYMOLY","4.4 (31 reviews)","From $43.00",2018/03/07
"Fresh Rose Hydrating Face Serum 1 oz","By Fresh","4.5 (47 reviews)",,2018/03/07
"Proactiv+ Redness Relief Serum","By Proactiv","3.7 (63 reviews)","From $51.95",2018/03/07
"L'Oréal Paris Age Perfect® Hydra-Nutrition Advanced Skin Repair Daily Serum","By L'Oréal Paris","4.4 (49 reviews)","From $13.99",2018/03/07
"Peter Thomas Roth Facial Expression Line Serum","By Peter Thomas Roth","4.4 (38 reviews)",,2018/03/07
"Timeless Skin Care 20% Vitamin C + E Ferulic Acid Serum 1 oz.","By Timeless Skin Care","4.7 (43 reviews)","2 varieties from $24.95",2018/03/07
"First Aid Beauty Facial Radiance Serum","By First Aid Beauty","4.5 (44 reviews)",,2018/03/07
"Kate Somerville Tight'N Cryogenic Tightening Gel","By Kate Somerville","4.2 (34 reviews)","From $125.00",2018/03/07
"NARS Essential Vitamin Serum","By NARS","4.8 (38 reviews)",,2018/03/07
"Garnier Nutritioniste Skin Renew Serum, 1.7-Ounce Bottle","By Garnier","3.8 (53 reviews)",,2018/03/07
"Bobbi Brown Extra Bright Advanced Serum","By Bobbi Brown","4.4 (52 reviews)",,2018/03/07
"SKINFOOD Agave Cactus Serum","By SKINFOOD","4.1 (44 reviews)",,2018/03/07
"Perricone MD H2 Elemental Energy Hydrating Booster Serum","By Perricone MD","4.4 (43 reviews)","From $100.00",2018/03/07
"The Ordinary Azelaic Acid Suspension 10% 1 oz/ 30 mL","By The Ordinary","4.1 (32 reviews)","From $5.50",2018/03/07
"Tony Moly - Floria Brightening Peeling Gel 150ml 150ml","By TONYMOLY","4.5 (31 reviews)","From $13.50",2018/03/07
"Givenchy Radically No Surgetics Restorative Age Defying Concentrate","By Givenchy","4.5 (46 reviews)",,2018/03/07
"Yon-Ka Paris Nutri+ Booster","By Yonka","4.8 (23 reviews)","From $62.00",2018/03/07
"evologie Intensive Blemish Serum","By Evologie","4.5 (41 reviews)","From $35.00",2018/03/07
"Dr. Jart+ Cicapair Tiger Grass Re. Pair Serum","By Dr. Jart+","4.6 (36 reviews)","From $46.00",2018/03/07
"Tatcha Radiant Deep Brightening Serum","By Tatcha","4.5 (39 reviews)",,2018/03/07
"The Body Shop Vitamin E Moisture Serum","By The Body Shop","4.2 (45 reviews)","2 varieties from $21.00",2018/03/07
"Tatcha Luminous Deep Hydration Firming Serum 1 oz","By Tatcha","4.5 (44 reviews)","From $95.00",2018/03/07
"Estée Lauder Advanced Time Zone Age Reversing Line Wrinkle Gel","By Estée Lauder","4.3 (23 reviews)",,2018/03/07
"Garnier Ultra-Lift 2-In-1 Wrinkle Reducer Serum & Moisturizer For Wrinkles + Firming","By Garnier","3.9 (52 reviews)","From $12.98",2018/03/07
"Elizabeth Arden Prevage Anti-aging Daily Serum","By Elizabeth Arden","4.2 (44 reviews)","3 varieties from $113.16",2018/03/07
"Josie Maran Argan Reserve Healthy Skin Concentrate","By Josie Maran","4.3 (46 reviews)","From $78.00",2018/03/07
"Algenist Power Advanced Wrinkle Fighter Serum","By Algenist","4.3 (35 reviews)","From $90.00",2018/03/07
"NIVEA Pro-White Ice Mud Serum Foam","By Nivea","4.7 (22 reviews)","2 varieties from $12.49",2018/03/07
"Anastasia Beverly Hills Even Brighter Face Serum","By Anastasia Beverly Hills","4.6 (38 reviews)",,2018/03/07
"Estee Lauder Perfectionist Cp+ Wrinkle Lifting Serum 7ml / .24 Fl. Oz.","By Estée Lauder","4.4 (31 reviews)",,2018/03/07
"Tata Harper Concentrated Brightening Serum, 30ml","By Tata Harper","4.5 (27 reviews)","From $230.00",2018/03/07
"Garnier Ultra-Lift 2-in-1 Wrinkle Reducer Serum and Moisturizer for Wrinkles and Firming","By Garnier","3.8 (53 reviews)","From $13.49",2018/03/07
"Kate Somerville DermalQuench Liquid Lift(TM) + Retinol Advanced Resurfacing Treatment","By Kate Somerville","4.6 (35 reviews)","From $98.00",2018/03/07
"100% Pure Brightening Serum","By 100% Pure","4.2 (43 reviews)","From $52.07",2018/03/07
"Mario Badescu Peptide Renewal Serum","By Mario Badescu","4.3 (41 reviews)","2 varieties from $45.00",2018/03/07
"Bioré MENS Kao Deep Oil Clear Face Wash","By Bioré","4.4 (55 reviews)","From $10.36",2018/03/07
"Dr. Brandt® LaserFX Lift Serum","By Dr. Brandt Skincare","4.1 (32 reviews)",,2018/03/07
"CLINIQUE Fresh Pressed Daily Booster with Pure Vitamin C 10% 4 Count - 0.29 oz/ 8.5 mL","By Clinique","4.6 (37 reviews)","From $76.50",2018/03/07
"Peter Thomas Roth Un-Wrinkle Targeted Deep Wrinkle Fast-Acting Serum, 1 oz","By Peter Thomas Roth","4.1 (41 reviews)","From $120.00",2018/03/07
"Dermaced Redness Redux Advanced Rosacea & Skin Redness Serum, 1 oz.","By Dermaced Redness Redux","2.5 (2 reviews)",,2018/03/07
"Arbonne Arbonne Calm Soothing Facial Serum","By Arbonne","4.6 (35 reviews)",,2018/03/07
"dermalogica Ultracalming Serum Concentrate, 1.3 oz","By Dermalogica","4.6 (40 reviews)","From $40.42",2018/03/07
"NEOGEN - Dermalogy White Truffle Serum In Oil Drop 50ml (US & EU Edition) 50ml","By Neogen","4.6 (26 reviews)",,2018/03/07
"Clinique Sculptwear Lift And Contour Serum For Face and Neck","By Clinique","4.4 (37 reviews)","2 varieties from $54.50",2018/03/07
"First Aid Beauty Uplifting Serum","By First Aid Beauty","4.0 (46 reviews)",,2018/03/07
"Olay Regenerist Micro-sculpting Serum 0.5 Oz/15ml (TWO-PACK)","By Olay","4.3 (43 reviews)","From $21.99",2018/03/07
"Dr. Brandt® Skincare Collagen Serum","By Dr. Brandt Skincare","4.4 (38 reviews)",,2018/03/07
"doTERRA Veráge™ Immortelle Hydrating Serum","By Doterra","4.8 (29 reviews)",,2018/03/07
"Dr. Brandt® Duo Sample Glow Resurfacing Serum & Retinol Hydracreme","By Dr. Brandt Skincare","4.3 (33 reviews)",,2018/03/07
"Algenist Elevate Firming & Lifting Contouring Serum","By Algenist","4.3 (36 reviews)","From $108.00",2018/03/07
"Dr. Brandt® Skincare Donotage with Drbrandt Beauty Sleep Serum","By Dr. Brandt Skincare","4.2 (40 reviews)","From $155.00",2018/03/07
"Yes to Blueberries Age Refresh Intensive Skin Repair Serum","By Yes To","3.7 (47 reviews)","From $19.47",2018/03/07
"Peter Thomas Roth FiRMx Firming Night Moisturizer","By Peter Thomas Roth","4.5 (33 reviews)",,2018/03/07
"Elizabeth Arden Estee Lauder Enlighten Dark Spot Correcting Night Serum 75ml/2.5oz","By Estée Lauder","4.5 (22 reviews)",,2018/03/07
"Exuviance Vespera Bionic Serum","By Exuviance","4.7 (34 reviews)","From $52.00",2018/03/07
"Dr Dennis Gross Vitamin Brightening Serum","By Dr. Dennis Gross Skincare","4.3 (27 reviews)",,2018/03/07
"Chanel HYDRA BEAUTY MICRO SERUM Intense Replenishing Hydration-NO COLOUR-30 ml","By Chanel","4.7 (30 reviews)","From $110.00",2018/03/07
"Dr. Brandt® LaserFX Perfect Serum","By Dr. Brandt Skincare","4.5 (31 reviews)",,2018/03/07
"LANEIGE Mini Pore Blur Perfector 1.3 oz/ 40 mL","By Laneige","4.6 (26 reviews)","From $32.00",2018/03/07
